Title,Description,Source,Date,full_text,cleaned_text,processed_text,sentiment
Mayhem Rocks Mexico After Cartel Boss Is Killed,"“The Mexican government said it killed the nation’s most wanted cartel boss on Sunday, setting off a wave of fires and violence across the country as cartel operatives sought to exact revenge in an unsettling show of force,” the New York Times reports. “Nemes…",Politicalwire.com,2026-02-23T03:23:56Z,"Mayhem Rocks Mexico After Cartel Boss Is Killed “The Mexican government said it killed the nation’s most wanted cartel boss on Sunday, setting off a wave of fires and violence across the country as cartel operatives sought to exact revenge in an unsettling show of force,” the New York Times reports. “Nemes…",mayhem rocks mexico after cartel boss is killed the mexican government said it killed the nations most wanted cartel boss on sunday setting off a wave of fires and violence across the country as cartel operatives sought to exact revenge in an unsettling show of force the new york times reports nemes,mayhem rocks mexico cartel boss killed mexican government said killed nations wanted cartel boss sunday setting wave fires violence across country cartel operatives sought exact revenge unsettling show force new york times reports nemes,Negative
Who was Mukul Roy The architect of West Bengals changing political order,"Veteran politician Mukul Roy has passed away at the age of 71. Roy was a key figure in West Bengal politics, co-founding the Trinamool Congress and later joining the Bharatiya Janata Party. He served as Union Railway Minister. His political journey saw signif…",The Times of India,2026-02-23T03:19:58Z,"Who was Mukul Roy The architect of West Bengals changing political order Veteran politician Mukul Roy has passed away at the age of 71. Roy was a key figure in West Bengal politics, co-founding the Trinamool Congress and later joining the Bharatiya Janata Party. He served as Union Railway Minister. His political journey saw signif…",who was mukul roy the architect of west bengals changing political order veteran politician mukul roy has passed away at the age of roy was a key figure in west bengal politics cofounding the trinamool congress and later joining the bharatiya janata party he served as union railway minister his political journey saw signif,mukul roy architect west bengals changing political order veteran politician mukul roy passed away age roy key figure west bengal politics cofounding trinamool congress later joining bharatiya janata party served union railway minister political journey saw signif,Neutral
What is driving the current USIran crisis and diplomacy world,Diplomatic talks amid a rising military posture Two parallel trends are defining the moment: an intensifying U.S. military presence in the Middle East and last‑ditch diplomatic efforts to prevent a wider confrontation. American negotiators and Iranian officia…,Alltoc.com,2026-02-23T03:14:05Z,What is driving the current USIran crisis and diplomacy world Diplomatic talks amid a rising military posture Two parallel trends are defining the moment: an intensifying U.S. military presence in the Middle East and last‑ditch diplomatic efforts to prevent a wider confrontation. American negotiators and Iranian officia…,what is driving the current usiran crisis and diplomacy world diplomatic talks amid a rising military posture two parallel trends are defining the moment an intensifying us military presence in the middle east and lastditch diplomatic efforts to prevent a wider confrontation american negotiators and iranian officia,driving current usiran crisis diplomacy world diplomatic talks amid rising military posture two parallel trends defining moment intensifying military presence middle east lastditch diplomatic efforts prevent wider confrontation american negotiators iranian officia,Negative
Why is FBI Director Kash Patel criticized politics,"Questions about conduct, travel and use of resources Public scrutiny of the bureau’s leader intensified after photographs and video showed him celebrating with members of the U.S. men’s hockey team inside the team locker room following a gold‑medal win. The i…",Alltoc.com,2026-02-23T03:09:07Z,"Why is FBI Director Kash Patel criticized politics Questions about conduct, travel and use of resources Public scrutiny of the bureau’s leader intensified after photographs and video showed him celebrating with members of the U.S. men’s hockey team inside the team locker room following a gold‑medal win. The i…",why is fbi director kash patel criticized politics questions about conduct travel and use of resources public scrutiny of the bureaus leader intensified after photographs and video showed him celebrating with members of the us mens hockey team inside the team locker room following a goldmedal win the i,fbi director kash patel criticized politics questions conduct travel use resources public scrutiny bureaus leader intensified photographs video showed celebrating members mens hockey team inside team locker room following goldmedal win,Positive
What led to the fatal shooting at MaraLago politics,Agents confronted an armed intruder inside secure perimeter Law enforcement officers shot and killed a man after he entered the secured grounds around the Palm Beach estate used by the former president. The U.S. Secret Service said officers observed the indiv…,Alltoc.com,2026-02-23T03:09:07Z,What led to the fatal shooting at MaraLago politics Agents confronted an armed intruder inside secure perimeter Law enforcement officers shot and killed a man after he entered the secured grounds around the Palm Beach estate used by the former president. The U.S. Secret Service said officers observed the indiv…,what led to the fatal shooting at maralago politics agents confronted an armed intruder inside secure perimeter law enforcement officers shot and killed a man after he entered the secured grounds around the palm beach estate used by the former president the us secret service said officers observed the indiv,led fatal shooting maralago politics agents confronted armed intruder inside secure perimeter law enforcement officers shot killed man entered secured grounds around palm beach estate used former president secret service said officers observed indiv,Negative
Hargreaves Lansdown turns Downing Street drama into biggest brand push yet,A cinematic campaign created by Wonderhood Studios positions the investment firm as a steady presence through four decades of political and economic shifts,Creative Review,2026-02-23T03:02:21Z,Hargreaves Lansdown turns Downing Street drama into biggest brand push yet A cinematic campaign created by Wonderhood Studios positions the investment firm as a steady presence through four decades of political and economic shifts,hargreaves lansdown turns downing street drama into biggest brand push yet a cinematic campaign created by wonderhood studios positions the investment firm as a steady presence through four decades of political and economic shifts,hargreaves lansdown turns downing street drama biggest brand push yet cinematic campaign created wonderhood studios positions investment firm steady presence four decades political economic shifts,Positive
Forget Le Pen French politics has a new archvillain,The far-right National Rally wants to build a firewall around the hard-left France Unbowed after the killing of Quentin Deranque.,POLITICO.eu,2026-02-23T03:00:00Z,Forget Le Pen French politics has a new archvillain The far-right National Rally wants to build a firewall around the hard-left France Unbowed after the killing of Quentin Deranque.,forget le pen french politics has a new archvillain the farright national rally wants to build a firewall around the hardleft france unbowed after the killing of quentin deranque,forget pen french politics new archvillain farright national rally wants build firewall around hardleft france unbowed killing quentin deranque,Positive
Ep 1378 High Agency Trading with Michael Covel on Trend Following Radio,"Please enjoy my monologue High Agency Trading with Michael Covel on Trend Following Radio. This episode may also include great outside guests from my archive. --- I'm MICHAEL COVEL, the host of TREND FOLLOWING RADIO, and I'm proud to have delivered 10+ millio…",Trendfollowingradio.com,2026-02-23T03:00:00Z,"Ep 1378 High Agency Trading with Michael Covel on Trend Following Radio Please enjoy my monologue High Agency Trading with Michael Covel on Trend Following Radio. This episode may also include great outside guests from my archive. --- I'm MICHAEL COVEL, the host of TREND FOLLOWING RADIO, and I'm proud to have delivered 10+ millio…",ep high agency trading with michael covel on trend following radio please enjoy my monologue high agency trading with michael covel on trend following radio this episode may also include great outside guests from my archive im michael covel the host of trend following radio and im proud to have delivered millio,high agency trading michael covel trend following radio please enjoy monologue high agency trading michael covel trend following radio episode may also include great outside guests archive michael covel host trend following radio proud delivered millio,Positive
Greenland Denmark says no thanks to Trumps hospital ship offer,Denmark and its territory Greenland reject Donald Trump's offer to send a naval hospital ship to the Arctic island coveted by the US leader.,ABC News (AU),2026-02-23T02:55:47Z,Greenland Denmark says no thanks to Trumps hospital ship offer Denmark and its territory Greenland reject Donald Trump's offer to send a naval hospital ship to the Arctic island coveted by the US leader.,greenland denmark says no thanks to trumps hospital ship offer denmark and its territory greenland reject donald trumps offer to send a naval hospital ship to the arctic island coveted by the us leader,greenland denmark says thanks trumps hospital ship offer denmark territory greenland reject donald trumps offer send naval hospital ship arctic island coveted leader,Positive
Reform UK unveils plan to protect churches from being turned into mosques in bid to restore Britains Christian heritage,"A Reform government would move to give churches protected status to ensure they are not turned into mosques. The party’s new home affairs spokesman, Zia Yusuf, plans to “restore Britain’s Christian heritage” by enacting mass deportations of illegal migrants a…",Freerepublic.com,2026-02-23T02:52:40Z,"Reform UK unveils plan to protect churches from being turned into mosques in bid to restore Britains Christian heritage A Reform government would move to give churches protected status to ensure they are not turned into mosques. The party’s new home affairs spokesman, Zia Yusuf, plans to “restore Britain’s Christian heritage” by enacting mass deportations of illegal migrants a…",reform uk unveils plan to protect churches from being turned into mosques in bid to restore britains christian heritage a reform government would move to give churches protected status to ensure they are not turned into mosques the partys new home affairs spokesman zia yusuf plans to restore britains christian heritage by enacting mass deportations of illegal migrants a,reform unveils plan protect churches turned mosques bid restore britains christian heritage reform government would move give churches protected status ensure turned mosques partys new home affairs spokesman zia yusuf plans restore britains christian heritage enacting mass deportations illegal migrants,Negative
Punch the Lonely Baby Monkey Has a New BFF and Its a Beautiful Thing,"It’s Sunday night after a big week in the news, and doubtless it will all crank up again Monday morning,...",Redstate.com,2026-02-23T02:49:54Z,"Punch the Lonely Baby Monkey Has a New BFF and Its a Beautiful Thing It’s Sunday night after a big week in the news, and doubtless it will all crank up again Monday morning,...",punch the lonely baby monkey has a new bff and its a beautiful thing its sunday night after a big week in the news and doubtless it will all crank up again monday morning,punch lonely baby monkey new bff beautiful thing sunday night big week news doubtless crank monday morning,Positive
FBI Director Kash Patel celebrates with US mens hockey team after Olympic win CNN Politics,"FBI Director Kash Patel celebrated with the US men’s hockey team in Milan after their historic gold medal win over Canada on Sunday, according to a video obtained by CNN.",CNN,2026-02-23T02:48:10Z,"FBI Director Kash Patel celebrates with US mens hockey team after Olympic win CNN Politics FBI Director Kash Patel celebrated with the US men’s hockey team in Milan after their historic gold medal win over Canada on Sunday, according to a video obtained by CNN.",fbi director kash patel celebrates with us mens hockey team after olympic win cnn politics fbi director kash patel celebrated with the us mens hockey team in milan after their historic gold medal win over canada on sunday according to a video obtained by cnn,fbi director kash patel celebrates mens hockey team olympic win cnn politics fbi director kash patel celebrated mens hockey team milan historic gold medal win canada sunday according video obtained cnn,Positive
Reminiscing last week Democracy discipline and dialogue,"KATHMANDU: Last week in Nepal unfolded as a dense convergence of electoral regulation, manifesto politics, constitutional debate, governance reform, communal tension, and sporting disappointment. With the March 5 House of Representatives (HoR) election approa…",Khabarhub.com,2026-02-23T02:45:15Z,"Reminiscing last week Democracy discipline and dialogue KATHMANDU: Last week in Nepal unfolded as a dense convergence of electoral regulation, manifesto politics, constitutional debate, governance reform, communal tension, and sporting disappointment. With the March 5 House of Representatives (HoR) election approa…",reminiscing last week democracy discipline and dialogue kathmandu last week in nepal unfolded as a dense convergence of electoral regulation manifesto politics constitutional debate governance reform communal tension and sporting disappointment with the march house of representatives hor election approa,reminiscing last week democracy discipline dialogue kathmandu last week nepal unfolded dense convergence electoral regulation manifesto politics constitutional debate governance reform communal tension sporting disappointment march house representatives hor election approa,Negative
Democrats theft of Staten Islands House seat is a fresh blow to NYs economy,Lady Justice is no longer blind in the Empire State: She's a slave of the Democratic Party.,New York Post,2026-02-23T02:35:06Z,Democrats theft of Staten Islands House seat is a fresh blow to NYs economy Lady Justice is no longer blind in the Empire State: She's a slave of the Democratic Party.,democrats theft of staten islands house seat is a fresh blow to nys economy lady justice is no longer blind in the empire state shes a slave of the democratic party,democrats theft staten islands house seat fresh blow nys economy lady justice longer blind empire state shes slave democratic party,Negative
Inside the real jobs crisis Despite the jobs numbers structural worklessness is a problem,"After much talk of an economic slowdown, February brought reassuring headlines. The official unemployment rate had fallen as another 130,000 jobs were added to the US economy, according to the Bureau of Labor Statistics. That is good news, but it is not the w…",Freerepublic.com,2026-02-23T02:31:27Z,"Inside the real jobs crisis Despite the jobs numbers structural worklessness is a problem After much talk of an economic slowdown, February brought reassuring headlines. The official unemployment rate had fallen as another 130,000 jobs were added to the US economy, according to the Bureau of Labor Statistics. That is good news, but it is not the w…",inside the real jobs crisis despite the jobs numbers structural worklessness is a problem after much talk of an economic slowdown february brought reassuring headlines the official unemployment rate had fallen as another jobs were added to the us economy according to the bureau of labor statistics that is good news but it is not the w,inside real jobs crisis despite jobs numbers structural worklessness problem much talk economic slowdown february brought reassuring headlines official unemployment rate fallen another jobs added economy according bureau labor statistics good news,Positive
Aunty Pauline democracy and the fine line between truth and fear,We’ve been asked to broach the subject of Pauline Hanson. Now that’s a tough one. Because damned if we do. Damned if we don’t. How do you speak truth when half the country may jump down your throat? Where is the line between freedom of speech and hate speech?…,Starcommunity.com.au,2026-02-23T02:23:04Z,Aunty Pauline democracy and the fine line between truth and fear We’ve been asked to broach the subject of Pauline Hanson. Now that’s a tough one. Because damned if we do. Damned if we don’t. How do you speak truth when half the country may jump down your throat? Where is the line between freedom of speech and hate speech?…,aunty pauline democracy and the fine line between truth and fear weve been asked to broach the subject of pauline hanson now thats a tough one because damned if we do damned if we dont how do you speak truth when half the country may jump down your throat where is the line between freedom of speech and hate speech,aunty pauline democracy fine line truth fear weve asked broach subject pauline hanson thats tough one damned damned dont speak truth half country may jump throat line freedom speech hate speech,Negative
RussiaUkraine war List of key events day 1460,"These are the key developments from day 1,460 of Russia’s war on Ukraine.",Al Jazeera English,2026-02-23T02:02:59Z,"RussiaUkraine war List of key events day 1460 These are the key developments from day 1,460 of Russia’s war on Ukraine.",russiaukraine war list of key events day these are the key developments from day of russias war on ukraine,russiaukraine war list key events day key developments day russias war ukraine,Neutral
Matthew Horncastle eyes Williams Corporation IPO and future in politics,Williams Corp's managing director builds a polarising online brand as IPO looms.,New Zealand Herald,2026-02-23T02:02:25Z,Matthew Horncastle eyes Williams Corporation IPO and future in politics Williams Corp's managing director builds a polarising online brand as IPO looms.,matthew horncastle eyes williams corporation ipo and future in politics williams corps managing director builds a polarising online brand as ipo looms,matthew horncastle eyes williams corporation ipo future politics williams corps managing director builds polarising online brand ipo looms,Neutral
FReeper Canteen Hall of Heroes HMS Glowworm 23 February 2026,Our Troops Rock! Thank you for all you do! For the freedom you enjoyed yesterday... Thank the Veterans who served in The United States Armed Forces. Looking forward to tomorrow's freedom? Support The United States Armed Forces Today! ~ Hall of Heroes ~HMS Glo…,Freerepublic.com,2026-02-23T02:00:55Z,FReeper Canteen Hall of Heroes HMS Glowworm 23 February 2026 Our Troops Rock! Thank you for all you do! For the freedom you enjoyed yesterday... Thank the Veterans who served in The United States Armed Forces. Looking forward to tomorrow's freedom? Support The United States Armed Forces Today! ~ Hall of Heroes ~HMS Glo…,freeper canteen hall of heroes hms glowworm february our troops rock thank you for all you do for the freedom you enjoyed yesterday thank the veterans who served in the united states armed forces looking forward to tomorrows freedom support the united states armed forces today hall of heroes hms glo,freeper canteen hall heroes hms glowworm february troops rock thank freedom enjoyed yesterday thank veterans served united states armed forces looking forward tomorrows freedom support united states armed forces today hall heroes hms glo,Positive
Kim reelected to top post of North Koreas ruling party,"North Korean leader Kim Jong Un has been reelected to the top post of the ruling Workers’ Party, with delegates crediting him for bolstering the country’s nuclear arsenal and strengthening its regional standing",Abcnews.com,2026-02-23T01:57:36Z,"Kim reelected to top post of North Koreas ruling party North Korean leader Kim Jong Un has been reelected to the top post of the ruling Workers’ Party, with delegates crediting him for bolstering the country’s nuclear arsenal and strengthening its regional standing",kim reelected to top post of north koreas ruling party north korean leader kim jong un has been reelected to the top post of the ruling workers party with delegates crediting him for bolstering the countrys nuclear arsenal and strengthening its regional standing,kim reelected top post north koreas ruling party north korean leader kim jong reelected top post ruling workers party delegates crediting bolstering countrys nuclear arsenal strengthening regional standing,Positive
Beyond ballot Why Nepals elections alone cannot deliver stability,"Ballots alone in Nepal alone cannot resolve the country’s deeper crises. Political paralysis has slowed decision-making and undermined public trust, while governance failures leave citizens frustrated with services and accountability. At the same time, millio…",Khabarhub.com,2026-02-23T01:45:12Z,"Beyond ballot Why Nepals elections alone cannot deliver stability Ballots alone in Nepal alone cannot resolve the country’s deeper crises. Political paralysis has slowed decision-making and undermined public trust, while governance failures leave citizens frustrated with services and accountability. At the same time, millio…",beyond ballot why nepals elections alone cannot deliver stability ballots alone in nepal alone cannot resolve the countrys deeper crises political paralysis has slowed decisionmaking and undermined public trust while governance failures leave citizens frustrated with services and accountability at the same time millio,beyond ballot nepals elections alone deliver stability ballots alone nepal alone resolve countrys deeper crises political paralysis slowed decisionmaking undermined public trust governance failures leave citizens frustrated services accountability time millio,Negative
California Democrats preach affordability at convention after raising costs,It was fitting that the California Democratic Party gathered in San Francisco to talk about “affordability.” They created the problem.,New York Post,2026-02-23T01:44:55Z,California Democrats preach affordability at convention after raising costs It was fitting that the California Democratic Party gathered in San Francisco to talk about “affordability.” They created the problem.,california democrats preach affordability at convention after raising costs it was fitting that the california democratic party gathered in san francisco to talk about affordability they created the problem,california democrats preach affordability convention raising costs fitting california democratic party gathered san francisco talk affordability created problem,Positive
Debanking JPMorgan Admits Closing Trump Accounts After Jan 6,"A growing legal battle between President Donald Trump and one of America’s most powerful financial institutions is putting a spotlight on a controversial issue that could affect businesses, investors, and everyday Americans alike: debanking. JPMorgan Chase ha…",Freerepublic.com,2026-02-23T01:40:26Z,"Debanking JPMorgan Admits Closing Trump Accounts After Jan 6 A growing legal battle between President Donald Trump and one of America’s most powerful financial institutions is putting a spotlight on a controversial issue that could affect businesses, investors, and everyday Americans alike: debanking. JPMorgan Chase ha…",debanking jpmorgan admits closing trump accounts after jan a growing legal battle between president donald trump and one of americas most powerful financial institutions is putting a spotlight on a controversial issue that could affect businesses investors and everyday americans alike debanking jpmorgan chase ha,debanking jpmorgan admits closing trump accounts jan growing legal battle president donald trump one americas powerful financial institutions putting spotlight controversial issue could affect businesses investors everyday americans alike debanking jpmorgan chase,Positive
Just A Few Scary Tragic And Awful Things I Learned This Week,"Lucy Harrison was visiting her father, Kris Harrison, when he fatally shot her in the chest following a huge argument about politics (specifically, Trump) and guns.View Entire Post ›",Buzzfeed,2026-02-23T01:31:02Z,"Just A Few Scary Tragic And Awful Things I Learned This Week Lucy Harrison was visiting her father, Kris Harrison, when he fatally shot her in the chest following a huge argument about politics (specifically, Trump) and guns.View Entire Post ›",just a few scary tragic and awful things i learned this week lucy harrison was visiting her father kris harrison when he fatally shot her in the chest following a huge argument about politics specifically trump and gunsview entire post,scary tragic awful things learned week lucy harrison visiting father kris harrison fatally shot chest following huge argument politics specifically trump gunsview entire post,Negative
