Title,Description,Source,Date,URL,Topic,full_text,cleaned_text
Sunday's 'Playful Precision': a robotics brand designed to give you your time back,"Most technology competes for your attention. Sunday is building the complete opposite, a new kind of robotics company focused on returning time to people's lives. Its identity, created in collabora...",Creative Boom,"26 Mar 2026, 07:30",https://www.creativeboom.com/news/sundays-playful-precision-a-robotics-brand-designed-to-give-you-your-time-back/,technology,"Sunday's 'Playful Precision': a robotics brand designed to give you your time back Most technology competes for your attention. Sunday is building the complete opposite, a new kind of robotics company focused on returning time to people's lives. Its identity, created in collabora...",sunday playful precision robotics brand designed give time back technology competes attention sunday building complete opposite new kind robotics company focused returning time people lives identity created collabora
"Samsung Reportedly Drops Plans To Design Its Exynos 2800 On A Sub-2nm Process, Preferring Healthy Yields And Optimizations Over Cutting-Edge Lithography","The introduction of Samsung’s first-generation 2nm GAA process will be followed by improved iterations of the lithography, with the Korean giant reportedly planning to complete the design of its cutting-edge SoC, the Exynos 2800, within this year. The signifi…",Wccftech,"26 Mar 2026, 07:29",https://wccftech.com/exynos-2800-to-be-mass-produced-on-improved-2nm-process/,technology,"Samsung Reportedly Drops Plans To Design Its Exynos 2800 On A Sub-2nm Process, Preferring Healthy Yields And Optimizations Over Cutting-Edge Lithography The introduction of Samsung’s first-generation 2nm GAA process will be followed by improved iterations of the lithography, with the Korean giant reportedly planning to complete the design of its cutting-edge SoC, the Exynos 2800, within this year. The signifi…",samsung reportedly drops plans design exynos sub process preferring healthy yields optimizations cutting edge lithography introduction samsung first generation gaa process followed improved iterations lithography korean giant reportedly planning complete design cutting edge soc exynos within year signifi
"OLAPLEX, a Leading, Science-Led Prestige Hair Care Brand, to be Acquired by Henkel for $1.4 Billion",Combination pairs OLAPLEX’s premium hair care brand with Henkel’s global reach and resources Transaction is expected to accelerate OLAPLEX’s value...,GlobeNewswire,"26 Mar 2026, 07:25",https://www.globenewswire.com/news-release/2026/03/26/3262757/0/en/OLAPLEX-a-Leading-Science-Led-Prestige-Hair-Care-Brand-to-be-Acquired-by-Henkel-for-1-4-Billion.html,technology,"OLAPLEX, a Leading, Science-Led Prestige Hair Care Brand, to be Acquired by Henkel for $1.4 Billion Combination pairs OLAPLEX’s premium hair care brand with Henkel’s global reach and resources Transaction is expected to accelerate OLAPLEX’s value...",olaplex leading science led prestige hair care brand acquired henkel billion combination pairs olaplex premium hair care brand henkel global reach resources transaction expected accelerate olaplex value
Universal Microwave Technology ramps up OISL output as LEO delivery deadlines threaten supply chains,"SATELLITE 2026, the international satellite industry's premier event, runs from March 23 to 26 in Washington, where Universal Microwave Technology, Inc. will once again engage with global satellite operators, equipment makers, component suppliers, and governm…",Digitimes,"26 Mar 2026, 07:24",https://www.digitimes.com/news/a20260325PD202/umt-leo-2026-component-production.html,technology,"Universal Microwave Technology ramps up OISL output as LEO delivery deadlines threaten supply chains SATELLITE 2026, the international satellite industry's premier event, runs from March 23 to 26 in Washington, where Universal Microwave Technology, Inc. will once again engage with global satellite operators, equipment makers, component suppliers, and governm…",universal microwave technology ramps oisl output leo delivery deadlines threaten supply chains satellite international satellite industry premier event runs march washington universal microwave technology inc engage global satellite operators equipment makers component suppliers governm
Iran war deflects attention from Ukraine as an emboldened Russia starts spring offensive,The Iran war has deflected global attention from Russia’s all-out invasion of its neighbor Ukraine as Europe’s biggest conflict since World War II enters its fifth year and an emboldened Kremlin undertakes a spring offensive,Abcnews.com,"26 Mar 2026, 07:23",https://abcnews.com/International/wireStory/iran-war-deflects-attention-ukraine-emboldened-russia-starts-131421742,technology,Iran war deflects attention from Ukraine as an emboldened Russia starts spring offensive The Iran war has deflected global attention from Russia’s all-out invasion of its neighbor Ukraine as Europe’s biggest conflict since World War II enters its fifth year and an emboldened Kremlin undertakes a spring offensive,iran war deflects attention ukraine emboldened russia starts spring offensive iran war deflected global attention russia invasion neighbor ukraine europe biggest conflict since world war enters fifth year emboldened kremlin undertakes spring offensive
CommodityHero Introduces TradeLens Platform to Expand Access to Historical Commodity Trade Data,New system integrates structured trade records into CommodityHero ecosystem to support brokerage workflows New system integrates structured trade records into CommodityHero ecosystem to support brokerage workflows,GlobeNewswire,"26 Mar 2026, 07:21",https://www.globenewswire.com/news-release/2026/03/26/3262756/0/en/CommodityHero-Introduces-TradeLens-Platform-to-Expand-Access-to-Historical-Commodity-Trade-Data.html,technology,CommodityHero Introduces TradeLens Platform to Expand Access to Historical Commodity Trade Data New system integrates structured trade records into CommodityHero ecosystem to support brokerage workflows New system integrates structured trade records into CommodityHero ecosystem to support brokerage workflows,commodityhero introduces tradelens platform expand access historical commodity trade data new system integrates structured trade records commodityhero ecosystem support brokerage workflows new system integrates structured trade records commodityhero ecosystem support brokerage workflows
L&T Tech to sell smart world portfolio to AM Group-backed AMI Paradigm Solutions,"The deal with L&amp;T Technology Services comes as AM Group advances plans to invest about $25 billion to build a 1 GW high-performance computing hub in Uttar Pradesh, underscoring its push into AI infrastructure.",Livemint,"26 Mar 2026, 07:20",https://www.livemint.com/companies/news/lt-tech-sells-smart-world-communication-business-india-ami-paradigm-11774504863808.html,technology,"L&T Tech to sell smart world portfolio to AM Group-backed AMI Paradigm Solutions The deal with L&amp;T Technology Services comes as AM Group advances plans to invest about $25 billion to build a 1 GW high-performance computing hub in Uttar Pradesh, underscoring its push into AI infrastructure.",tech sell smart world portfolio group backed ami paradigm solutions deal amp technology services comes group advances plans invest billion build high performance computing hub uttar pradesh underscoring push infrastructure
"As juries turn against social media for harming kids, Big Tech's invincibility starts to show cracks","Juries hold Meta and YouTube accountable for children's harm, signaling a shift in public perception against Big Tech's influence.",BusinessLine,"26 Mar 2026, 07:16",https://www.thehindubusinessline.com/info-tech/social-media/as-juries-turn-against-social-media-for-harming-kids-big-techs-invincibility-starts-to-show-cracks/article70787107.ece,technology,"As juries turn against social media for harming kids, Big Tech's invincibility starts to show cracks Juries hold Meta and YouTube accountable for children's harm, signaling a shift in public perception against Big Tech's influence.",juries turn social media harming kids big tech invincibility starts show cracks juries hold meta youtube accountable children harm signaling shift public perception big tech influence
India’s e-commerce hiring surges 35% in the last 2 years: Report,"India’s e-commerce and quick commerce sector is shifting to a capability-led hiring phase, with talent demand rising 35% from about 73,000 roles in 2023 to nearly 99,000 in 2025, according to CIEL HR. Hiring is now focused on technology roles such as software…",The Times of India,"26 Mar 2026, 07:13",https://economictimes.indiatimes.com/jobs/fresher/indias-e-commerce-hiring-surges-35-in-the-last-2-years-report/articleshow/129818183.cms,technology,"India’s e-commerce hiring surges 35% in the last 2 years: Report India’s e-commerce and quick commerce sector is shifting to a capability-led hiring phase, with talent demand rising 35% from about 73,000 roles in 2023 to nearly 99,000 in 2025, according to CIEL HR. Hiring is now focused on technology roles such as software…",india commerce hiring surges last years report india commerce quick commerce sector shifting capability led hiring phase talent demand rising roles nearly according ciel hiring focused technology roles software
One Tech Tip: Here's how AI can (and can't) help you in your job hunt,Finding a job feels harder than ever,Abcnews.com,"26 Mar 2026, 07:13",https://abcnews.com/Technology/wireStory/tech-tip-ai-job-hunt-131422677,technology,One Tech Tip: Here's how AI can (and can't) help you in your job hunt Finding a job feels harder than ever,one tech tip help job hunt finding job feels harder ever
GLOBAL POWER SOLUTIONS JOINS THE CANADA DATA CENTRES’ ALLIANCE,"Vancouver, British Columbia, March 26, 2026 (GLOBE NEWSWIRE) -- Global Power Solutions Corp. (TSXV: PWER) (FSE: NJA) (“Global” or the “Company”) announces that it has joined the Canada Data Centres’ Alliance (CDCA), a national industry organization representi…",GlobeNewswire,"26 Mar 2026, 07:05",https://www.globenewswire.com/news-release/2026/03/26/3262754/0/en/GLOBAL-POWER-SOLUTIONS-JOINS-THE-CANADA-DATA-CENTRES-ALLIANCE.html,technology,"GLOBAL POWER SOLUTIONS JOINS THE CANADA DATA CENTRES’ ALLIANCE Vancouver, British Columbia, March 26, 2026 (GLOBE NEWSWIRE) -- Global Power Solutions Corp. (TSXV: PWER) (FSE: NJA) (“Global” or the “Company”) announces that it has joined the Canada Data Centres’ Alliance (CDCA), a national industry organization representi…",global power solutions joins canada data centres alliance vancouver british columbia march globe newswire global power solutions corp tsxv pwer fse nja global company announces joined canada data centres alliance cdca national industry organization representi
Rising GPU costs force India to reassess AI incentives and hardware policy,"India is reviewing its technology incentive framework as surging graphics processing unit (GPU) prices reshape the economics of these policies, with implications for both manufacturing policy and public investment plans, according to officials and industry pa…",Digitimes,"26 Mar 2026, 07:03",https://www.digitimes.com/news/a20260325VL208/india-gpu-ai-incentives-policy.html,technology,"Rising GPU costs force India to reassess AI incentives and hardware policy India is reviewing its technology incentive framework as surging graphics processing unit (GPU) prices reshape the economics of these policies, with implications for both manufacturing policy and public investment plans, according to officials and industry pa…",rising gpu costs force india reassess incentives hardware policy india reviewing technology incentive framework surging graphics processing unit gpu prices reshape economics policies implications manufacturing policy public investment plans according officials industry
Samsung and SK Hynix accelerate expansion in China,"According to South Korean media BusinessKorea, major memory chip manufacturers Samsung Electronics and SK Hynix are making large-scale facility investments in their factories in China to upgrade their process technology and production capacity. Amid a global …",TechNode,"26 Mar 2026, 07:03",http://technode.com/2026/03/26/samsung-and-sk-hynix-accelerate-expansion-in-china/,technology,"Samsung and SK Hynix accelerate expansion in China According to South Korean media BusinessKorea, major memory chip manufacturers Samsung Electronics and SK Hynix are making large-scale facility investments in their factories in China to upgrade their process technology and production capacity. Amid a global …",samsung hynix accelerate expansion china according south korean media businesskorea major memory chip manufacturers samsung electronics hynix making large scale facility investments factories china upgrade process technology production capacity amid global
Tinder introduces ‘first-of-its-kind’ technology that will change dating game,Tinder is introducing ‘first-of-its-kind’ facial verification technology aimed to minimise the number of fake profiles on the app.,LADbible,"26 Mar 2026, 07:00",https://www.ladbible.com/news/technology/tinder-face-check-technology-profile-match-123929-20260325,technology,Tinder introduces ‘first-of-its-kind’ technology that will change dating game Tinder is introducing ‘first-of-its-kind’ facial verification technology aimed to minimise the number of fake profiles on the app.,tinder introduces first kind technology change dating game tinder introducing first kind facial verification technology aimed minimise number fake profiles app
Exynos 2600 vs Snapdragon 8 Elite: The Winner of the Samsung Galaxy S26 Test,"Samsung’s Galaxy S26 flagship smartphone is available in two distinct versions, each catering to different regions. The global variant is powered by the Exynos 2600 chipset, while the Snapdragon 8 Gen 5 Galaxy Edition is reserved for markets like North Americ…",Geeky Gadgets,"26 Mar 2026, 07:00",https://www.geeky-gadgets.com/galaxy-s26-battery-runtime/,technology,"Exynos 2600 vs Snapdragon 8 Elite: The Winner of the Samsung Galaxy S26 Test Samsung’s Galaxy S26 flagship smartphone is available in two distinct versions, each catering to different regions. The global variant is powered by the Exynos 2600 chipset, while the Snapdragon 8 Gen 5 Galaxy Edition is reserved for markets like North Americ…",exynos snapdragon elite winner samsung galaxy test samsung galaxy flagship smartphone available two distinct versions catering different regions global variant powered exynos chipset snapdragon gen galaxy edition reserved markets like north americ
How South Korea Can Bring Iron to the Strait of Hormuz,Recent developments indicate that the United States has begun redeploying critical missile defense assets — including elements of the Terminal High Altitude Area Defense (THAAD) system and Patriot batteries — from South Korea to the Middle East. As Washington…,War on the Rocks,"26 Mar 2026, 07:00",https://warontherocks.com/2026/03/how-south-korea-can-bring-iron-to-the-strait-of-hormuz/,technology,How South Korea Can Bring Iron to the Strait of Hormuz Recent developments indicate that the United States has begun redeploying critical missile defense assets — including elements of the Terminal High Altitude Area Defense (THAAD) system and Patriot batteries — from South Korea to the Middle East. As Washington…,south korea bring iron strait hormuz recent developments indicate united states begun redeploying critical missile defense assets including elements terminal high altitude area defense thaad system patriot batteries south korea middle east washington
Ireland's first mobile video call made via satellite,Ireland's first mobile video phone call via satellite using a standard smartphone has been made.,RTE,"26 Mar 2026, 07:00",https://www.rte.ie/news/ireland/2026/0326/1565222-satellite-call-ireland/,technology,Ireland's first mobile video call made via satellite Ireland's first mobile video phone call via satellite using a standard smartphone has been made.,ireland first mobile video call made via satellite ireland first mobile video phone call via satellite using standard smartphone made
"What History, Evidence and Competing Views Tell Us About AI and Higher Education","What History, Evidence and Competing Views Tell Us About AI and Higher Education joshua.m.kim@d… Thu, 03/26/2026 - 03:00 AM Conversations about technology and education too often skip past the accumulated evidence on teaching and learning in order to chase…",Inside Higher Ed,"26 Mar 2026, 07:00",https://www.insidehighered.com/opinion/columns/learning-innovation/2026/03/26/what-history-evidence-competing-views-say-about-ai,technology,"What History, Evidence and Competing Views Tell Us About AI and Higher Education What History, Evidence and Competing Views Tell Us About AI and Higher Education joshua.m.kim@d… Thu, 03/26/2026 - 03:00 AM Conversations about technology and education too often skip past the accumulated evidence on teaching and learning in order to chase…",history evidence competing views tell higher education history evidence competing views tell higher education joshua kim thu conversations technology education often skip past accumulated evidence teaching learning order chase
"eBay Launches ‘The NYC Edit,’ Revealing What New York’s Most ‘In-the-Know’ Tastemakers Are Selling and Buying","From 1999 Tom Ford Gucci to L.L.Bean Boat and Totes, 10 New Yorkers share what’s moving from their own closets to the marketplace, and what they’re making room to buy next.",Ebayinc.com,"26 Mar 2026, 07:00",https://www.ebayinc.com/stories/news/ebay-launches-the-nyc-edit-revealing-what-new-yorks-most-in-the-know-tastemakers-are-selling-and-buying/,technology,"eBay Launches ‘The NYC Edit,’ Revealing What New York’s Most ‘In-the-Know’ Tastemakers Are Selling and Buying From 1999 Tom Ford Gucci to L.L.Bean Boat and Totes, 10 New Yorkers share what’s moving from their own closets to the marketplace, and what they’re making room to buy next.",ebay launches nyc edit revealing new york know tastemakers selling buying tom ford gucci bean boat totes new yorkers share moving closets marketplace making room buy next
What is tech addiction? A court ruling makes it Big Tech’s next big problem,"The verdict in a landmark lawsuit over addictive social media design—and a wave of similar cases against Meta, YouTube, TikTok, and Snap—could force Silicon Valley to confront whether its most powerful and “sticky” products are behaving like hard-to-kick drug…",Fortune,"26 Mar 2026, 07:00",https://fortune.com/2026/03/26/what-is-tech-addiction-meta-youtube-trial/,technology,"What is tech addiction? A court ruling makes it Big Tech’s next big problem The verdict in a landmark lawsuit over addictive social media design—and a wave of similar cases against Meta, YouTube, TikTok, and Snap—could force Silicon Valley to confront whether its most powerful and “sticky” products are behaving like hard-to-kick drug…",tech addiction court ruling makes big tech next big problem verdict landmark lawsuit addictive social media design wave similar cases meta youtube tiktok snap could force silicon valley confront whether powerful sticky products behaving like hard kick drug
The world’s consumers are ready for robotaxis. James Peng of Pony AI wants to make sure they’re riding in his,"Peng sees a world with more robotaxis as “inevitable,” citing safety and convenience. “People love to drive; they don’t love driving all the time.""",Fortune,"26 Mar 2026, 07:00",https://fortune.com/2026/03/26/pony-ai-ceo-james-peng-china-robotaxi/,technology,"The world’s consumers are ready for robotaxis. James Peng of Pony AI wants to make sure they’re riding in his Peng sees a world with more robotaxis as “inevitable,” citing safety and convenience. “People love to drive; they don’t love driving all the time.""",world consumers ready robotaxis james peng pony wants make sure riding peng sees world robotaxis inevitable citing safety convenience people love drive love driving time
BMW Group builds new Competence Centre Circularity at Wackersdorf site,"+++ BMW Group Recycling and Dismantling Centre (RDC) set to become Competence Centre Circularity +++ Strengthening the circular economy, resource efficiency and technology development +++ Clear signal for the future of the Wackersdorf location +++",Bmwgroup.com,"26 Mar 2026, 07:00",https://www.press.bmwgroup.com/global/article/detail/T0456550EN/bmw-group-builds-new-competence-centre-circularity-at-wackersdorf-site?language=en,technology,"BMW Group builds new Competence Centre Circularity at Wackersdorf site +++ BMW Group Recycling and Dismantling Centre (RDC) set to become Competence Centre Circularity +++ Strengthening the circular economy, resource efficiency and technology development +++ Clear signal for the future of the Wackersdorf location +++",bmw group builds new competence centre circularity wackersdorf site bmw group recycling dismantling centre rdc set become competence centre circularity strengthening circular economy resource efficiency technology development clear signal future wackersdorf location
"Area Studies, Once Vital, Wither Without Funding","Area Studies, Once Vital, Wither Without Funding Emma Whitford Thu, 03/26/2026 - 03:00 AM Area studies centers were born out of World War II and supported by the U.S. government as an essential part of national security strategy. Now, they are disapp…",Inside Higher Ed,"26 Mar 2026, 07:00",https://www.insidehighered.com/news/business/academic-programs/2026/03/26/area-studies-once-vital-wither-without-funding,technology,"Area Studies, Once Vital, Wither Without Funding Area Studies, Once Vital, Wither Without Funding Emma Whitford Thu, 03/26/2026 - 03:00 AM Area studies centers were born out of World War II and supported by the U.S. government as an essential part of national security strategy. Now, they are disapp…",area studies vital wither without funding area studies vital wither without funding emma whitford thu area studies centers born world war supported government essential part national security strategy disapp
Integrating AI Across the Liberal Arts,"Integrating AI Across the Liberal Arts Joshua.Bay Thu, 03/26/2026 - 03:00 AM The University of Richmond’s new Center for Liberal Arts and AI helps students and faculty explore artificial intelligence ethically, critically and across disciplines. B…",Inside Higher Ed,"26 Mar 2026, 07:00",https://www.insidehighered.com/news/student-success/academic-life/2026/03/26/richmond-integrates-ai-across-liberal-arts,technology,"Integrating AI Across the Liberal Arts Integrating AI Across the Liberal Arts Joshua.Bay Thu, 03/26/2026 - 03:00 AM The University of Richmond’s new Center for Liberal Arts and AI helps students and faculty explore artificial intelligence ethically, critically and across disciplines. B…",integrating across liberal arts integrating across liberal arts joshua bay thu university richmond new center liberal arts helps students faculty explore artificial intelligence ethically critically across disciplines
Ireland's first mobile video call via satellite is made,Ireland's first mobile video phone call via satellite using a standard smartphone has been made.,RTE,"26 Mar 2026, 07:00",https://www.rte.ie/news/business/2026/0326/1565222-satellite-call-ireland/,technology,Ireland's first mobile video call via satellite is made Ireland's first mobile video phone call via satellite using a standard smartphone has been made.,ireland first mobile video call via satellite made ireland first mobile video phone call via satellite using standard smartphone made
Use of ‘prefab’ to describe modern building methods should be avoided due to ‘historic stigma’,"Participants in research recalled ‘poor-quality prefab classrooms’ and other portable structures, associating with impermanence or lower standards",The Irish Times,"26 Mar 2026, 07:00",https://www.irishtimes.com/ireland/housing-planning/2026/03/26/use-of-prefab-to-describe-modern-building-methods-should-be-avoided-due-to-historic-stigma/,technology,"Use of ‘prefab’ to describe modern building methods should be avoided due to ‘historic stigma’ Participants in research recalled ‘poor-quality prefab classrooms’ and other portable structures, associating with impermanence or lower standards",use prefab describe modern building methods avoided due historic stigma participants research recalled poor quality prefab classrooms portable structures associating impermanence lower standards
