Title,Description,Source,Date,full_text,cleaned_text,processed_text,sentiment
Pulled the number out of his arse Crikey readers respond to the CFMEU corruption crisis,"Plus, is the support for One Nation just the result of 'protest poll' answers?
The post ‘Pulled the number out of his arse’: Crikey readers respond to the CFMEU corruption crisis appeared first on Crikey.",Crikey,2026-02-23T01:26:32Z,"Pulled the number out of his arse Crikey readers respond to the CFMEU corruption crisis Plus, is the support for One Nation just the result of 'protest poll' answers?
The post ‘Pulled the number out of his arse’: Crikey readers respond to the CFMEU corruption crisis appeared first on Crikey.",pulled the number out of his arse crikey readers respond to the cfmeu corruption crisis plus is the support for one nation just the result of protest poll answers the post pulled the number out of his arse crikey readers respond to the cfmeu corruption crisis appeared first on crikey,pulled number arse crikey readers respond cfmeu corruption crisis plus support one nation result protest poll answers post pulled number arse crikey readers respond cfmeu corruption crisis appeared first crikey,Positive
DHS Blames Democrats For ShutdownForced Disaster Aid Restrictions,"DHS announced Sunday it was working to conserve ""funds and personnel"" to avoid risks to national security and public safety during a lapse in federal funding.",The Daily Caller,2026-02-23T01:19:41Z,"DHS Blames Democrats For ShutdownForced Disaster Aid Restrictions DHS announced Sunday it was working to conserve ""funds and personnel"" to avoid risks to national security and public safety during a lapse in federal funding.",dhs blames democrats for shutdownforced disaster aid restrictions dhs announced sunday it was working to conserve funds and personnel to avoid risks to national security and public safety during a lapse in federal funding,dhs blames democrats shutdownforced disaster aid restrictions dhs announced sunday working conserve funds personnel avoid risks national security public safety lapse federal funding,Neutral
Kim Jong Un reelected to top post of North Koreas ruling party as it hails his nuclear buildup,North Korean leader Kim Jong Un has been reelected as the top official of the ruling Workers' Party. Delegates credited him for strengthening the nation's nuclear capabilities and its position in the region. This move signals a continued focus on military dev…,The Times of India,2026-02-23T01:03:51Z,Kim Jong Un reelected to top post of North Koreas ruling party as it hails his nuclear buildup North Korean leader Kim Jong Un has been reelected as the top official of the ruling Workers' Party. Delegates credited him for strengthening the nation's nuclear capabilities and its position in the region. This move signals a continued focus on military dev…,kim jong un reelected to top post of north koreas ruling party as it hails his nuclear buildup north korean leader kim jong un has been reelected as the top official of the ruling workers party delegates credited him for strengthening the nations nuclear capabilities and its position in the region this move signals a continued focus on military dev,kim jong reelected top post north koreas ruling party hails nuclear buildup north korean leader kim jong reelected top official ruling workers party delegates credited strengthening nations nuclear capabilities position region move signals continued focus military dev,Positive
10 More Fantasy Books That Are Indisputable 1010 Masterpieces,"Image via HarperCollins

There are many incredible fantasy books that aren’t 10/10 releases, but the masterpieces that do achieve near-perfection are some of the best the genre has to offer. These 10/10 fantasy novels strike an ideal balance; they nail their …",ComicBook.com,2026-02-23T01:00:00Z,"10 More Fantasy Books That Are Indisputable 1010 Masterpieces Image via HarperCollins

There are many incredible fantasy books that aren’t 10/10 releases, but the masterpieces that do achieve near-perfection are some of the best the genre has to offer. These 10/10 fantasy novels strike an ideal balance; they nail their …",more fantasy books that are indisputable masterpieces image via harpercollins there are many incredible fantasy books that arent releases but the masterpieces that do achieve nearperfection are some of the best the genre has to offer these fantasy novels strike an ideal balance they nail their,fantasy books indisputable masterpieces image via harpercollins many incredible fantasy books arent releases masterpieces achieve nearperfection best genre offer fantasy novels strike ideal balance nail,Positive
Iran unrest escalates as gunfire tear gas hit universities amid looming US strike,"Tehran and Mashhad universities saw anti-government protests Sunday, with students chanting against Ali Khamenei as security forces reportedly used tear gas.",Fox News,2026-02-23T00:51:51Z,"Iran unrest escalates as gunfire tear gas hit universities amid looming US strike Tehran and Mashhad universities saw anti-government protests Sunday, with students chanting against Ali Khamenei as security forces reportedly used tear gas.",iran unrest escalates as gunfire tear gas hit universities amid looming us strike tehran and mashhad universities saw antigovernment protests sunday with students chanting against ali khamenei as security forces reportedly used tear gas,iran unrest escalates gunfire tear gas hit universities amid looming strike tehran mashhad universities saw antigovernment protests sunday students chanting ali khamenei security forces reportedly used tear gas,Neutral
Polands Military BuildUp Might Have Ultimately Been for Nothing,"The Washington Post published an insightful piece in late January about how “Poland built the E.U.’s biggest army, but the threat has changed”, which persuasively argues that the central role of drones in the Ukrainian Conflict has prompted …
The post Poland’…",Globalresearch.ca,2026-02-23T00:48:06Z,"Polands Military BuildUp Might Have Ultimately Been for Nothing The Washington Post published an insightful piece in late January about how “Poland built the E.U.’s biggest army, but the threat has changed”, which persuasively argues that the central role of drones in the Ukrainian Conflict has prompted …
The post Poland’…",polands military buildup might have ultimately been for nothing the washington post published an insightful piece in late january about how poland built the eus biggest army but the threat has changed which persuasively argues that the central role of drones in the ukrainian conflict has prompted the post poland,polands military buildup might ultimately nothing washington post published insightful piece late january poland built eus biggest army threat changed persuasively argues central role drones ukrainian conflict prompted post poland,Negative
HR Employee Was Constantly Talked Down To By A Toxic Manager So When She Landed A New Job Her Departure Forced The Boss To Cancel Her Vacation,Sometimes the exit interview practically writes itself!,Twistedsifter.com,2026-02-23T00:35:04Z,HR Employee Was Constantly Talked Down To By A Toxic Manager So When She Landed A New Job Her Departure Forced The Boss To Cancel Her Vacation Sometimes the exit interview practically writes itself!,hr employee was constantly talked down to by a toxic manager so when she landed a new job her departure forced the boss to cancel her vacation sometimes the exit interview practically writes itself,employee constantly talked toxic manager landed new job departure forced boss cancel vacation sometimes exit interview practically writes,Negative
CSPAN Sets Record Straight After Viral Clip Had Viewers Believing Donald Trump Called In With A Fake Name,We finally have some answers.,CinemaBlend,2026-02-23T00:32:43Z,CSPAN Sets Record Straight After Viral Clip Had Viewers Believing Donald Trump Called In With A Fake Name We finally have some answers.,cspan sets record straight after viral clip had viewers believing donald trump called in with a fake name we finally have some answers,cspan sets record straight viral clip viewers believing donald trump called fake name finally answers,Negative
Global Market Global cash is fuelling LatAm stock rally,"Latin American stocks are experiencing their strongest investor inflow in a decade, propelling markets in Brazil, Colombia, and Mexico to multi-year highs. This surge, driven by anticipation of policy shifts and potential interest rate cuts ahead of president…",The Times of India,2026-02-23T00:32:19Z,"Global Market Global cash is fuelling LatAm stock rally Latin American stocks are experiencing their strongest investor inflow in a decade, propelling markets in Brazil, Colombia, and Mexico to multi-year highs. This surge, driven by anticipation of policy shifts and potential interest rate cuts ahead of president…",global market global cash is fuelling latam stock rally latin american stocks are experiencing their strongest investor inflow in a decade propelling markets in brazil colombia and mexico to multiyear highs this surge driven by anticipation of policy shifts and potential interest rate cuts ahead of president,global market global cash fuelling latam stock rally latin american stocks experiencing strongest investor inflow decade propelling markets brazil colombia mexico multiyear highs surge driven anticipation policy shifts potential interest rate cuts ahead president,Neutral
Do You Have ID For that Shovel,"New York City is expecting something like two feet of snow, and the city’s government, led by socialist/Communist Zohran Mamdani, is encouraging able-bodied New Yorkers to help shovel the city out after the storm. But only, of course, if they have proper iden…",Freerepublic.com,2026-02-23T00:15:19Z,"Do You Have ID For that Shovel New York City is expecting something like two feet of snow, and the city’s government, led by socialist/Communist Zohran Mamdani, is encouraging able-bodied New Yorkers to help shovel the city out after the storm. But only, of course, if they have proper iden…",do you have id for that shovel new york city is expecting something like two feet of snow and the citys government led by socialistcommunist zohran mamdani is encouraging ablebodied new yorkers to help shovel the city out after the storm but only of course if they have proper iden,shovel new york city expecting something like two feet snow citys government led socialistcommunist zohran mamdani encouraging ablebodied new yorkers help shovel city storm course proper iden,Positive
Gothic Visual Novel Mystery Game Runt Gets a Free Demo,Indie game developer Grimtaste Studios and publisher DreadXP dropped a new demo this week for their upcoming rural gothic visual novel mystery game Runt. The demo will give you a chance to experience a bit of the opening story without getting into spoiler ter…,Bleeding Cool News,2026-02-23T00:12:07Z,Gothic Visual Novel Mystery Game Runt Gets a Free Demo Indie game developer Grimtaste Studios and publisher DreadXP dropped a new demo this week for their upcoming rural gothic visual novel mystery game Runt. The demo will give you a chance to experience a bit of the opening story without getting into spoiler ter…,gothic visual novel mystery game runt gets a free demo indie game developer grimtaste studios and publisher dreadxp dropped a new demo this week for their upcoming rural gothic visual novel mystery game runt the demo will give you a chance to experience a bit of the opening story without getting into spoiler ter,gothic visual novel mystery game runt gets free demo indie game developer grimtaste studios publisher dreadxp dropped new demo week upcoming rural gothic visual novel mystery game runt demo give chance experience bit opening story without getting spoiler ter,Negative
Malinauskas faces a landslide win in SA But cracks are appearing in his goodtime agenda,"The commercialisation of SA's prized public land, and the lack of transparency over significant deals with long-term implications, suggest an arrogance that may yet prove detrimental to the premier's reputation.
The post Malinauskas faces a landslide win in S…",Crikey,2026-02-23T00:08:26Z,"Malinauskas faces a landslide win in SA But cracks are appearing in his goodtime agenda The commercialisation of SA's prized public land, and the lack of transparency over significant deals with long-term implications, suggest an arrogance that may yet prove detrimental to the premier's reputation.
The post Malinauskas faces a landslide win in S…",malinauskas faces a landslide win in sa but cracks are appearing in his goodtime agenda the commercialisation of sas prized public land and the lack of transparency over significant deals with longterm implications suggest an arrogance that may yet prove detrimental to the premiers reputation the post malinauskas faces a landslide win in s,malinauskas faces landslide win cracks appearing goodtime agenda commercialisation sas prized public land lack transparency significant deals longterm implications suggest arrogance may yet prove detrimental premiers reputation post malinauskas faces landslide win,Positive
