Title,Description,Source,Date,URL,Topic,full_text,cleaned_text
CRKD Announces ULT PRO Wireless Gaming Controller,"CRKD, the premium collectible gaming brand known for their highly popular Nitro Deck, and line of premium rhythm gaming products, announced today the ULT PRO, a next-generation professional wireless gaming controller featuring multi-platform connectivity and …",Madshrimps.be,"26 Mar 2026, 08:33",https://www.madshrimps.be/news/crkd-announces-ult-pro-wireless-gaming-controller/,technology,"CRKD Announces ULT PRO Wireless Gaming Controller CRKD, the premium collectible gaming brand known for their highly popular Nitro Deck, and line of premium rhythm gaming products, announced today the ULT PRO, a next-generation professional wireless gaming controller featuring multi-platform connectivity and …",crkd announces ult pro wireless gaming controller crkd premium collectible gaming brand known highly popular nitro deck line premium rhythm gaming products announced today ult pro next generation professional wireless gaming controller featuring multi platform connectivity
Real Madrid believe superstar forward has fixed the weakness that held him back,"Vinicius Jr. is once again at the centre of attention at Real Madrid, but this time, it is not about his attacking brilliance. According to recent internal assessments from MARCA, it has come to ligh...",Madriduniversal.com,"26 Mar 2026, 08:30",https://madriduniversal.com/real-madrid-believe-superstar-forward-has-fixed-the-weakness-that-held-him-back/,technology,"Real Madrid believe superstar forward has fixed the weakness that held him back Vinicius Jr. is once again at the centre of attention at Real Madrid, but this time, it is not about his attacking brilliance. According to recent internal assessments from MARCA, it has come to ligh...",real madrid believe superstar forward fixed weakness held back vinicius centre attention real madrid time attacking brilliance according recent internal assessments marca come ligh
"Stocks fall, oil gains amid conflicting reports of US-Iran talks","Asian shares fell 1 per cent, snapping two-day gain",The Irish Times,"26 Mar 2026, 08:27",https://www.irishtimes.com/business/2026/03/26/stocks-fall-oil-gains-amid-conflicting-reports-of-us-iran-talks/,technology,"Stocks fall, oil gains amid conflicting reports of US-Iran talks Asian shares fell 1 per cent, snapping two-day gain",stocks fall oil gains amid conflicting reports iran talks asian shares fell per cent snapping two day gain
"What If Animals Were Always Talking, And We’ve Only Been Listening the Wrong Way?","New research reveals animal communication hinges on emotions, not just words. Early studies explored symbols, but Artificial Intelligence now deciphers subtle vocalizations and behaviors. This technology helps understand animal feelings and intentions. Sou…",The Times of India,"26 Mar 2026, 08:23",https://economictimes.indiatimes.com/news/international/us/what-if-animals-were-always-talking-and-weve-only-been-listening-the-wrong-way/articleshow/129819279.cms,technology,"What If Animals Were Always Talking, And We’ve Only Been Listening the Wrong Way? New research reveals animal communication hinges on emotions, not just words. Early studies explored symbols, but Artificial Intelligence now deciphers subtle vocalizations and behaviors. This technology helps understand animal feelings and intentions. Sou…",animals always talking listening wrong way new research reveals animal communication hinges emotions words early studies explored symbols artificial intelligence deciphers subtle vocalizations behaviors technology helps understand animal feelings intentions sou
Smart sleepers could be the glow-up night trains need,"Europe has a bit of an on-off relationship with night trains. A Berlin team’s smart cabin concept could lead to greater commitment. It's friday evening, and the Nightjet to Zurich is due to arrive at platform 13 of the main station in the German capital of Be…",DW (English),"26 Mar 2026, 08:23",https://www.dw.com/en/sleeper-trains-shrinking-activists-demand-more-routes-in-europe-berlin-private-cabins-price/a-75937028,technology,"Smart sleepers could be the glow-up night trains need Europe has a bit of an on-off relationship with night trains. A Berlin team’s smart cabin concept could lead to greater commitment. It's friday evening, and the Nightjet to Zurich is due to arrive at platform 13 of the main station in the German capital of Be…",smart sleepers could glow night trains need europe bit relationship night trains berlin team smart cabin concept could lead greater commitment friday evening nightjet zurich due arrive platform main station german capital
India’s first psychiatric ‘data repository’ launched at Bengaluru Nimhans,"CALM-Brain incorporates multiple modes in which disorders can be studied through MRIs, near-infrared spectroscopy, electroencephalograms, and genetics, amongst various other techniques.",The Indian Express,"26 Mar 2026, 08:22",https://indianexpress.com/article/cities/bangalore/india-first-psychiatric-data-repository-launched-bengaluru-nimhans-10602326/,technology,"India’s first psychiatric ‘data repository’ launched at Bengaluru Nimhans CALM-Brain incorporates multiple modes in which disorders can be studied through MRIs, near-infrared spectroscopy, electroencephalograms, and genetics, amongst various other techniques.",india first psychiatric data repository launched bengaluru nimhans calm brain incorporates multiple modes disorders studied mris near infrared spectroscopy electroencephalograms genetics amongst various techniques
CtrlChain expands services: Pallet Shipping.,"CtrlChain, transportation management company specialised in road freight across Europe and the US, is strengthening logistics with pallet transport service. […]",Emerce.nl,"26 Mar 2026, 08:17",https://www.emerce.nl/wire/ctrlchain-expands-services-pallet-shipping,technology,"CtrlChain expands services: Pallet Shipping. CtrlChain, transportation management company specialised in road freight across Europe and the US, is strengthening logistics with pallet transport service. […]",ctrlchain expands services pallet shipping ctrlchain transportation management company specialised road freight across europe strengthening logistics pallet transport service
"The ""Bathroom Switch"" That Cuts Moisture Buildup by Half","High bathroom moisture from daily showers can lead to mold and structural damage. Humidity sensing switches automatically activate exhaust fans when moisture levels rise, reducing humidity and preventing these issues. Studies show these smart devices effectiv…",The Times of India,"26 Mar 2026, 08:15",https://economictimes.indiatimes.com/news/international/us/the-bathroom-switch-that-cuts-moisture-buildup-by-half/articleshow/129819127.cms,technology,"The ""Bathroom Switch"" That Cuts Moisture Buildup by Half High bathroom moisture from daily showers can lead to mold and structural damage. Humidity sensing switches automatically activate exhaust fans when moisture levels rise, reducing humidity and preventing these issues. Studies show these smart devices effectiv…",bathroom switch cuts moisture buildup half high bathroom moisture daily showers lead mold structural damage humidity sensing switches automatically activate exhaust fans moisture levels rise reducing humidity preventing issues studies show smart devices effectiv
(PR) Gigabyte Z890 AORUS ELITE DUO X Now Available Featuring CQDIMM,"Gigabyte, the world's leading computer brand, announces the availability of its Z890 Plus series motherboards that support the new Intel Core Ultra 200S Plus series processors. Led by the Z890 AORUS ELITE DUO X, the Z890 Plus series brings next-generation mem…",Techpowerup.com,"26 Mar 2026, 08:15",https://www.techpowerup.com/347739/gigabyte-z890-aorus-elite-duo-x-now-available-featuring-cqdimm,technology,"(PR) Gigabyte Z890 AORUS ELITE DUO X Now Available Featuring CQDIMM Gigabyte, the world's leading computer brand, announces the availability of its Z890 Plus series motherboards that support the new Intel Core Ultra 200S Plus series processors. Led by the Z890 AORUS ELITE DUO X, the Z890 Plus series brings next-generation mem…",gigabyte aorus elite duo available featuring cqdimm gigabyte world leading computer brand announces availability plus series motherboards support new intel core ultra plus series processors led aorus elite duo plus series brings next generation mem
"What Makes MiniMax M2.7 So Special? The New AI, Explained","MiniMax M2.7 offers a balanced approach to artificial intelligence, designed to meet the needs of organizations constrained by computational resources. With 230 billion parameters and a processing speed of 50-100 tokens per second, it provides a practical sol…",Geeky Gadgets,"26 Mar 2026, 08:15",https://www.geeky-gadgets.com/minimax-ai-frontier-models/,technology,"What Makes MiniMax M2.7 So Special? The New AI, Explained MiniMax M2.7 offers a balanced approach to artificial intelligence, designed to meet the needs of organizations constrained by computational resources. With 230 billion parameters and a processing speed of 50-100 tokens per second, it provides a practical sol…",makes minimax special new explained minimax offers balanced approach artificial intelligence designed meet needs organizations constrained computational resources billion parameters processing speed tokens per second provides practical sol
A little-known Croatian startup is coming for the robotaxi market with help from Uber | TechCrunch,A little-known Croatian startup is coming for the robotaxi market with help from Uber | TechCrunchtechcrunch.com,TechCrunch,"26 Mar 2026, 08:15",https://techcrunch.com/2026/03/26/a-little-known-croatian-startup-is-coming-for-the-robotaxi-market-with-help-from-uber/,technology,A little-known Croatian startup is coming for the robotaxi market with help from Uber | TechCrunch A little-known Croatian startup is coming for the robotaxi market with help from Uber | TechCrunchtechcrunch.com,little known croatian startup coming robotaxi market help uber techcrunch little known croatian startup coming robotaxi market help uber techcrunchtechcrunch com
Washington and Silicon Valley have found their common enemy: China,"Lawmakers and tech executives may not agree on how to regulate AI, but they agree who the enemy is.",Fortune,"26 Mar 2026, 08:13",https://fortune.com/2026/03/26/dc-silicon-valley-common-enemy-china-hill-and-valley-forum/,technology,"Washington and Silicon Valley have found their common enemy: China Lawmakers and tech executives may not agree on how to regulate AI, but they agree who the enemy is.",washington silicon valley found common enemy china lawmakers tech executives may agree regulate agree enemy
What America gets out of its war with Iran,The US-Israeli war against Iran is not failing-the media's analysis is. Here is what is really going on. Analysis.,Israelnationalnews.com,"26 Mar 2026, 08:12",https://www.israelnationalnews.com/news/424604,technology,What America gets out of its war with Iran The US-Israeli war against Iran is not failing-the media's analysis is. Here is what is really going on. Analysis.,america gets war iran israeli war iran failing media analysis really going analysis
Expensive crude oil: An inflation India might benefit from,"Iran War: Rattling oil markets and predictions of $150 per barrel are forcing a reevaluation of cheap energy's long-held economic assumptions. This price shock, rather than a catastrophe, could be a necessary correction, aligning incentives and accelerating t…",The Times of India,"26 Mar 2026, 08:06",https://economictimes.indiatimes.com/news/economy/policy/expensive-crude-oil-an-inflation-india-might-benefit-from/articleshow/129818354.cms,technology,"Expensive crude oil: An inflation India might benefit from Iran War: Rattling oil markets and predictions of $150 per barrel are forcing a reevaluation of cheap energy's long-held economic assumptions. This price shock, rather than a catastrophe, could be a necessary correction, aligning incentives and accelerating t…",expensive crude oil inflation india might benefit iran war rattling oil markets predictions per barrel forcing reevaluation cheap energy long held economic assumptions price shock rather catastrophe could necessary correction aligning incentives accelerating
Punjab scraps plan to charge Rs 80 for downloading FIRs after public outrage,"Advocates Abhishek Malhotra and Vasu Ranjan Shandilya had filed a PIL in the Punjab and Haryana High Court, saying the government had monetised a fundamental right to access justice.",The Indian Express,"26 Mar 2026, 08:05",https://indianexpress.com/article/cities/chandigarh/punjab-scrap-charge-rs-80-firs-after-public-outrage-10602327/,technology,"Punjab scraps plan to charge Rs 80 for downloading FIRs after public outrage Advocates Abhishek Malhotra and Vasu Ranjan Shandilya had filed a PIL in the Punjab and Haryana High Court, saying the government had monetised a fundamental right to access justice.",punjab scraps plan charge downloading firs public outrage advocates abhishek malhotra vasu ranjan shandilya filed pil punjab haryana high court saying government monetised fundamental right access justice
The average phone now has a bigger battery than the S26 Ultra,"Phone makers have embraced bigger batteries in recent years, so is it any surprise that average battery capacity made a giant leap?",Android Authority,"26 Mar 2026, 08:03",https://www.androidauthority.com/smartphones-average-battery-capacity-increase-3652111/,technology,"The average phone now has a bigger battery than the S26 Ultra Phone makers have embraced bigger batteries in recent years, so is it any surprise that average battery capacity made a giant leap?",average phone bigger battery ultra phone makers embraced bigger batteries recent years surprise average battery capacity made giant leap
"Radiation Illness: Understanding Symptoms, Causes, and Treatments • Yesil Health AI",Radiation illness can arise from exposure to harmful radiation. ⚠️ Symptoms vary; early diagnosis is crucial for effective treatment.,Yesilhealth.com,"26 Mar 2026, 08:03",https://yesilhealth.com/your-health/radiation-illness-understanding-symptoms-causes-and-treatments-4/,technology,"Radiation Illness: Understanding Symptoms, Causes, and Treatments • Yesil Health AI Radiation illness can arise from exposure to harmful radiation. ⚠️ Symptoms vary; early diagnosis is crucial for effective treatment.",radiation illness understanding symptoms causes treatments yesil health radiation illness arise exposure harmful radiation symptoms vary early diagnosis crucial effective treatment
"Helium shock puts India’s semiconductor, PCB push at risk due to the Iran-Israel war","A critical input in semiconductor manufacturing, helium underpins everything from electric vehicles to smartphones.",Moneycontrol,"26 Mar 2026, 08:03",https://www.moneycontrol.com/news/business/helium-shock-puts-india-s-semiconductor-pcb-push-at-risk-due-to-the-iran-israel-war-13871222.html,technology,"Helium shock puts India’s semiconductor, PCB push at risk due to the Iran-Israel war A critical input in semiconductor manufacturing, helium underpins everything from electric vehicles to smartphones.",helium shock puts india semiconductor pcb push risk due iran israel war critical input semiconductor manufacturing helium underpins everything electric vehicles smartphones
Electronic warfare in the Persian Gulf: How GPS interference is disrupting the Middle East,"Since the start of the U.S.-Israel war with Iran on Feb. 28, interference with location-based services has disrupted life across the Persian Gulf.",CNBC,"26 Mar 2026, 08:01",https://www.cnbc.com/2026/03/26/how-gps-interference-is-disrupting-the-middle-east.html,technology,"Electronic warfare in the Persian Gulf: How GPS interference is disrupting the Middle East Since the start of the U.S.-Israel war with Iran on Feb. 28, interference with location-based services has disrupted life across the Persian Gulf.",electronic warfare persian gulf gps interference disrupting middle east since start israel war iran feb interference location based services disrupted life across persian gulf
Samsung Just Made a Surprising U-Turn on the Galaxy S27 Ultra’s S Pen,"Samsung has reaffirmed its commitment to the S Pen as a defining feature of its Galaxy S Ultra series, even as it continues to pursue sleeker designs for its flagship smartphones. This decision highlights the company’s dedication to maintaining the unique fun…",Geeky Gadgets,"26 Mar 2026, 08:00",https://www.geeky-gadgets.com/samsung-galaxy-s27-ultra-s-pen/,technology,"Samsung Just Made a Surprising U-Turn on the Galaxy S27 Ultra’s S Pen Samsung has reaffirmed its commitment to the S Pen as a defining feature of its Galaxy S Ultra series, even as it continues to pursue sleeker designs for its flagship smartphones. This decision highlights the company’s dedication to maintaining the unique fun…",samsung made surprising turn galaxy ultra pen samsung reaffirmed commitment pen defining feature galaxy ultra series even continues pursue sleeker designs flagship smartphones decision highlights company dedication maintaining unique fun
Temperature gets a new definition using a quantum device,A device that relies on quantum effects and oversized atoms may be a more reliable way to measure temperature that doesn't require calibration,New Scientist,"26 Mar 2026, 08:00",https://www.newscientist.com/article/2520758-temperature-gets-a-new-definition-using-a-quantum-device/,technology,Temperature gets a new definition using a quantum device A device that relies on quantum effects and oversized atoms may be a more reliable way to measure temperature that doesn't require calibration,temperature gets new definition using quantum device device relies quantum effects oversized atoms may reliable way measure temperature require calibration
Why Price Takes a Back Seat in Embedded Finance Deals,"Embedded finance is increasingly central to how B2B companies buy and sell, but it only works as well as the bank or FinTech behind it. New PYMNTS Intelligence research finds that trust and security are the deciding factors in who a B2B firm chooses to work w…",pymnts.com,"26 Mar 2026, 08:00",https://www.pymnts.com/news/b2b-payments/2026/why-price-takes-a-back-seat-in-embedded-finance-deals/,technology,"Why Price Takes a Back Seat in Embedded Finance Deals Embedded finance is increasingly central to how B2B companies buy and sell, but it only works as well as the bank or FinTech behind it. New PYMNTS Intelligence research finds that trust and security are the deciding factors in who a B2B firm chooses to work w…",price takes back seat embedded finance deals embedded finance increasingly central companies buy sell works well bank fintech behind new pymnts intelligence research finds trust security deciding factors firm chooses work
"YouTube Joins Questex’s StreamTV Europe as Diamond Sponsor, Signaling Major Industry Momentum for the Inaugural Event April 13-15 in Lisbon","New speakers from Sky, Roku, Samsung TV Plus, Omnicom Media Group and more join a growing roster of leaders shaping the future of streaming New speakers from Sky, Roku, Samsung TV Plus, Omnicom Media Group and more join a growing roster of leaders shaping the…",GlobeNewswire,"26 Mar 2026, 08:00",https://www.globenewswire.com/news-release/2026/03/26/3262775/0/en/YouTube-Joins-Questex-s-StreamTV-Europe-as-Diamond-Sponsor-Signaling-Major-Industry-Momentum-for-the-Inaugural-Event-April-13-15-in-Lisbon.html,technology,"YouTube Joins Questex’s StreamTV Europe as Diamond Sponsor, Signaling Major Industry Momentum for the Inaugural Event April 13-15 in Lisbon New speakers from Sky, Roku, Samsung TV Plus, Omnicom Media Group and more join a growing roster of leaders shaping the future of streaming New speakers from Sky, Roku, Samsung TV Plus, Omnicom Media Group and more join a growing roster of leaders shaping the…",youtube joins questex streamtv europe diamond sponsor signaling major industry momentum inaugural event april lisbon new speakers sky roku samsung plus omnicom media group join growing roster leaders shaping future streaming new speakers sky roku samsung plus omnicom media group join growing roster leaders shaping
Which Education Jobs Are Growing the Fastest? Mostly Non-Classroom Roles.,Student support and tech professions are projected to make gains while teaching positions shrink.,Edsurge.com,"26 Mar 2026, 08:00",https://www.edsurge.com/news/2026-03-26-which-education-jobs-are-growing-the-fastest-mostly-non-classroom-roles,technology,Which Education Jobs Are Growing the Fastest? Mostly Non-Classroom Roles. Student support and tech professions are projected to make gains while teaching positions shrink.,education jobs growing fastest mostly non classroom roles student support tech professions projected make gains teaching positions shrink
Notice convening the Annual General Meeting in BioPorto A/S,26 March 2026Announcement no. 5 Notice convening the Annual General Meeting in BioPorto A/S The Board of Directors hereby convenes the Annual General...,GlobeNewswire,"26 Mar 2026, 08:00",https://www.globenewswire.com/news-release/2026/03/26/3262779/0/en/Notice-convening-the-Annual-General-Meeting-in-BioPorto-A-S.html,technology,Notice convening the Annual General Meeting in BioPorto A/S 26 March 2026Announcement no. 5 Notice convening the Annual General Meeting in BioPorto A/S The Board of Directors hereby convenes the Annual General...,notice convening annual general meeting bioporto march announcement notice convening annual general meeting bioporto board directors hereby convenes annual general
Why we made a film about Mark Fisher called We Are Making A Film About Mark Fisher,"Tim Burrows explains how a conversation on a park bench led to an inventive film about a unique, much missed voice in political philosophy and cultural criticism We are making a film about Mark Fisher. That much is true. The idea came about in October 2024 wh…",The Quietus,"26 Mar 2026, 08:00",https://thequietus.com/opinion-and-essays/black-sky-thinking/mark-fisher-film-essay/,technology,"Why we made a film about Mark Fisher called We Are Making A Film About Mark Fisher Tim Burrows explains how a conversation on a park bench led to an inventive film about a unique, much missed voice in political philosophy and cultural criticism We are making a film about Mark Fisher. That much is true. The idea came about in October 2024 wh…",made film mark fisher called making film mark fisher tim burrows explains conversation park bench led inventive film unique much missed voice political philosophy cultural criticism making film mark fisher much true idea came october
"In consumer goods, access to capital no longer the primary differentiator; profitability key for survival",India's consumer businesses are changing their strategy. They are now focusing on profitability rather than just rapid growth. Digital platforms like e-commerce and quick commerce are helping brands reach customers efficiently. This allows for building demand…,The Times of India,"26 Mar 2026, 07:56",https://economictimes.indiatimes.com/industry/cons-products/fmcg/in-consumer-goods-access-to-capital-no-longer-the-primary-differentiator-profitability-key-for-survival/articleshow/129818876.cms,technology,"In consumer goods, access to capital no longer the primary differentiator; profitability key for survival India's consumer businesses are changing their strategy. They are now focusing on profitability rather than just rapid growth. Digital platforms like e-commerce and quick commerce are helping brands reach customers efficiently. This allows for building demand…",consumer goods access capital longer primary differentiator profitability key survival india consumer businesses changing strategy focusing profitability rather rapid growth digital platforms like commerce quick commerce helping brands reach customers efficiently allows building demand
Orioles host the Twins for the season opener,"Minnesota Twins vs. Baltimore Orioles Baltimore; Thursday, 3:05 p.m. EDT PITCHING PROBABLES: Twins: Joe Ryan (0-0); Orioles: Trevor Rogers (0-0) BETMGM...",Yahoo Entertainment,"26 Mar 2026, 07:56",https://sports.yahoo.com/articles/orioles-host-twins-season-opener-075615385.html,technology,"Orioles host the Twins for the season opener Minnesota Twins vs. Baltimore Orioles Baltimore; Thursday, 3:05 p.m. EDT PITCHING PROBABLES: Twins: Joe Ryan (0-0); Orioles: Trevor Rogers (0-0) BETMGM...",orioles host twins season opener minnesota twins baltimore orioles baltimore thursday edt pitching probables twins joe ryan orioles trevor rogers betmgm
Cubs host the Nationals in the season opener,"Washington Nationals vs. Chicago Cubs Chicago; Thursday, 2:20 p.m. EDT PITCHING PROBABLES: Nationals: Cade Cavalli (0-0); Cubs: Matthew Boyd (0-0) BETMGM...",Yahoo Entertainment,"26 Mar 2026, 07:56",https://sports.yahoo.com/articles/cubs-host-nationals-season-opener-075615567.html,technology,"Cubs host the Nationals in the season opener Washington Nationals vs. Chicago Cubs Chicago; Thursday, 2:20 p.m. EDT PITCHING PROBABLES: Nationals: Cade Cavalli (0-0); Cubs: Matthew Boyd (0-0) BETMGM...",cubs host nationals season opener washington nationals chicago cubs chicago thursday edt pitching probables nationals cade cavalli cubs matthew boyd betmgm
