Title,Description,Source,Date,full_text,cleaned_text,processed_text,sentiment
The Grind celebrates 10 years of coffee success at Bathurst RSL,The Grind celebrates 10 years of coffee success at Bathurst RSLwesternadvocate.com.au,Western Advocate,2026-02-23T06:13:05Z,The Grind celebrates 10 years of coffee success at Bathurst RSL The Grind celebrates 10 years of coffee success at Bathurst RSLwesternadvocate.com.au,the grind celebrates years of coffee success at bathurst rsl the grind celebrates years of coffee success at bathurst rslwesternadvocatecomau,grind celebrates years coffee success bathurst rsl grind celebrates years coffee success bathurst rslwesternadvocatecomau,Positive
How can the White House release UFO files politics,"The administration announced plans to identify and release government records related to unidentified aerial phenomena and “extraterrestrial life,” but turning that pledge into public documents requires legal and procedural steps. What the White House can and…",Alltoc.com,2026-02-23T06:07:48Z,"How can the White House release UFO files politics The administration announced plans to identify and release government records related to unidentified aerial phenomena and “extraterrestrial life,” but turning that pledge into public documents requires legal and procedural steps. What the White House can and…",how can the white house release ufo files politics the administration announced plans to identify and release government records related to unidentified aerial phenomena and extraterrestrial life but turning that pledge into public documents requires legal and procedural steps what the white house can and,white house release ufo files politics administration announced plans identify release government records related unidentified aerial phenomena extraterrestrial life turning pledge public documents requires legal procedural steps white house,Positive
What caused the MaraLago shooting politics,"What happened and what investigators say Shortly after midnight, security personnel at the presidential resort encountered an unauthorized person who had breached the secure perimeter. Law enforcement officers say the individual was observed carrying what app…",Alltoc.com,2026-02-23T06:07:48Z,"What caused the MaraLago shooting politics What happened and what investigators say Shortly after midnight, security personnel at the presidential resort encountered an unauthorized person who had breached the secure perimeter. Law enforcement officers say the individual was observed carrying what app…",what caused the maralago shooting politics what happened and what investigators say shortly after midnight security personnel at the presidential resort encountered an unauthorized person who had breached the secure perimeter law enforcement officers say the individual was observed carrying what app,caused maralago shooting politics happened investigators say shortly midnight security personnel presidential resort encountered unauthorized person breached secure perimeter law enforcement officers say individual observed carrying app,Positive
Congress goes on offensive after Bhupen Borahs exit launches statewide chargesheet against Himanta Govt,"Even as former APCC president Bhupen Kumar Borah walked out of the Congress, the Assam Pradesh Congress Committee (APCC) on Sunday hit back with an aggressive statewide campaign targeting Chief Minister Himanta Biswa Sarma and his government. The party has be…",Syllad.com,2026-02-23T06:01:31Z,"Congress goes on offensive after Bhupen Borahs exit launches statewide chargesheet against Himanta Govt Even as former APCC president Bhupen Kumar Borah walked out of the Congress, the Assam Pradesh Congress Committee (APCC) on Sunday hit back with an aggressive statewide campaign targeting Chief Minister Himanta Biswa Sarma and his government. The party has be…",congress goes on offensive after bhupen borahs exit launches statewide chargesheet against himanta govt even as former apcc president bhupen kumar borah walked out of the congress the assam pradesh congress committee apcc on sunday hit back with an aggressive statewide campaign targeting chief minister himanta biswa sarma and his government the party has be,congress goes offensive bhupen borahs exit launches statewide chargesheet himanta govt even former apcc president bhupen kumar borah walked congress assam pradesh congress committee apcc sunday hit back aggressive statewide campaign targeting chief minister himanta biswa sarma government party,Neutral
Why the TV industry keeps falling in love with the Kennedys Americas answer to the royal family,"As Ryan Murphy takes on the story of JFK Jr and Carolyn Bessette, and Netflix plan an all-American successor to ‘The Crown’, Katie Rosseinsky explores the quasi-mythical appeal of the Kennedy family",The-independent.com,2026-02-23T06:00:00Z,"Why the TV industry keeps falling in love with the Kennedys Americas answer to the royal family As Ryan Murphy takes on the story of JFK Jr and Carolyn Bessette, and Netflix plan an all-American successor to ‘The Crown’, Katie Rosseinsky explores the quasi-mythical appeal of the Kennedy family",why the tv industry keeps falling in love with the kennedys americas answer to the royal family as ryan murphy takes on the story of jfk jr and carolyn bessette and netflix plan an allamerican successor to the crown katie rosseinsky explores the quasimythical appeal of the kennedy family,industry keeps falling love kennedys americas answer royal family ryan murphy takes story jfk carolyn bessette netflix plan allamerican successor crown katie rosseinsky explores quasimythical appeal kennedy family,Positive
Agency reckoning CIA purges politicized intel from Obama Biden era in sweeping corrective action,"The CIA has retracted or revised 19 intelligence reports from 2015-2023 for failing impartiality standards. The politicized reports covered topics like domestic extremism, LGBT issues and contraception, straying from core national security. This action follow…",Naturalnews.com,2026-02-23T06:00:00Z,"Agency reckoning CIA purges politicized intel from Obama Biden era in sweeping corrective action The CIA has retracted or revised 19 intelligence reports from 2015-2023 for failing impartiality standards. The politicized reports covered topics like domestic extremism, LGBT issues and contraception, straying from core national security. This action follow…",agency reckoning cia purges politicized intel from obama biden era in sweeping corrective action the cia has retracted or revised intelligence reports from for failing impartiality standards the politicized reports covered topics like domestic extremism lgbt issues and contraception straying from core national security this action follow,agency reckoning cia purges politicized intel obama biden era sweeping corrective action cia retracted revised intelligence reports failing impartiality standards politicized reports covered topics like domestic extremism lgbt issues contraception straying core national security action follow,Positive
Tamil Nadu assembly polls MMK to contest under DMK alliance seeks five seats,DMK leaders met with Manithaneya Makkal Katchi and Indian Union Muslim League for seat sharing. MMK requested five seats. Naam Tamilar Katchi announced all 234 candidates. AIADMK revealed five election promises. The Tamil Nadu Assembly elections are approachi…,The Times of India,2026-02-23T05:57:16Z,Tamil Nadu assembly polls MMK to contest under DMK alliance seeks five seats DMK leaders met with Manithaneya Makkal Katchi and Indian Union Muslim League for seat sharing. MMK requested five seats. Naam Tamilar Katchi announced all 234 candidates. AIADMK revealed five election promises. The Tamil Nadu Assembly elections are approachi…,tamil nadu assembly polls mmk to contest under dmk alliance seeks five seats dmk leaders met with manithaneya makkal katchi and indian union muslim league for seat sharing mmk requested five seats naam tamilar katchi announced all candidates aiadmk revealed five election promises the tamil nadu assembly elections are approachi,tamil nadu assembly polls mmk contest dmk alliance seeks five seats dmk leaders met manithaneya makkal katchi indian union muslim league seat sharing mmk requested five seats naam tamilar katchi announced candidates aiadmk revealed five election promises tamil nadu assembly elections approachi,Neutral
New report reframes modern power through a biblical lens in age of global turbulence,"At a time of global instability, questions about who holds power and how they use it have become increasingly urgent.",Christiantoday.com,2026-02-23T05:46:00Z,"New report reframes modern power through a biblical lens in age of global turbulence At a time of global instability, questions about who holds power and how they use it have become increasingly urgent.",new report reframes modern power through a biblical lens in age of global turbulence at a time of global instability questions about who holds power and how they use it have become increasingly urgent,new report reframes modern power biblical lens age global turbulence time global instability questions holds power use become increasingly urgent,Positive
In age of global turbulence new report reframes power through a biblical lens,"At a time of global instability, questions about who holds power and how they use it have become increasingly urgent.",Christiantoday.com,2026-02-23T05:46:00Z,"In age of global turbulence new report reframes power through a biblical lens At a time of global instability, questions about who holds power and how they use it have become increasingly urgent.",in age of global turbulence new report reframes power through a biblical lens at a time of global instability questions about who holds power and how they use it have become increasingly urgent,age global turbulence new report reframes power biblical lens time global instability questions holds power use become increasingly urgent,Positive
War of words in Kerala assembly over Sabarimala gold row,"Tensions escalated in the Kerala Assembly as the ruling LDF and opposition UDF clashed over the controversial Sabarimala gold loss. The UDF voiced their concerns over the arrest of Tantri Kandararu Rajeevaru, sparking heated debates. In response, ministers de…",The Times of India,2026-02-23T05:40:14Z,"War of words in Kerala assembly over Sabarimala gold row Tensions escalated in the Kerala Assembly as the ruling LDF and opposition UDF clashed over the controversial Sabarimala gold loss. The UDF voiced their concerns over the arrest of Tantri Kandararu Rajeevaru, sparking heated debates. In response, ministers de…",war of words in kerala assembly over sabarimala gold row tensions escalated in the kerala assembly as the ruling ldf and opposition udf clashed over the controversial sabarimala gold loss the udf voiced their concerns over the arrest of tantri kandararu rajeevaru sparking heated debates in response ministers de,war words kerala assembly sabarimala gold row tensions escalated kerala assembly ruling ldf opposition udf clashed controversial sabarimala gold loss udf voiced concerns arrest tantri kandararu rajeevaru sparking heated debates response ministers,Positive
Decoding the AI beliefs of Anthropic and its CEO Dario Amodei,"Here is a guide to Anthropic, Amodei and the company’s AI philosophy.",The Indian Express,2026-02-23T05:38:44Z,"Decoding the AI beliefs of Anthropic and its CEO Dario Amodei Here is a guide to Anthropic, Amodei and the company’s AI philosophy.",decoding the ai beliefs of anthropic and its ceo dario amodei here is a guide to anthropic amodei and the companys ai philosophy,decoding beliefs anthropic ceo dario amodei guide anthropic amodei companys philosophy,Neutral
Spat at and on call 247 for parttime wages Tipperary councillor shares realities of modern politics,"Local councillors are struggling to secure mortgages and support their families on what is technically a part-time wage for what many describe as a full-time role, according to the Tipperary native who is head of the councillors representative body.",Independent.ie,2026-02-23T05:30:00Z,"Spat at and on call 247 for parttime wages Tipperary councillor shares realities of modern politics Local councillors are struggling to secure mortgages and support their families on what is technically a part-time wage for what many describe as a full-time role, according to the Tipperary native who is head of the councillors representative body.",spat at and on call for parttime wages tipperary councillor shares realities of modern politics local councillors are struggling to secure mortgages and support their families on what is technically a parttime wage for what many describe as a fulltime role according to the tipperary native who is head of the councillors representative body,spat call parttime wages tipperary councillor shares realities modern politics local councillors struggling secure mortgages support families technically parttime wage many describe fulltime role according tipperary native head councillors representative body,Positive
Kim reelected to top post of North Koreas ruling party,The report suggests he will double down on accelerating a nuclear arsenal already equipped with missiles capable of threatening Asian U.S. allies and the American mainland.,KCRA Sacramento,2026-02-23T05:26:23Z,Kim reelected to top post of North Koreas ruling party The report suggests he will double down on accelerating a nuclear arsenal already equipped with missiles capable of threatening Asian U.S. allies and the American mainland.,kim reelected to top post of north koreas ruling party the report suggests he will double down on accelerating a nuclear arsenal already equipped with missiles capable of threatening asian us allies and the american mainland,kim reelected top post north koreas ruling party report suggests double accelerating nuclear arsenal already equipped missiles capable threatening asian allies american mainland,Positive
Dont cancel the pension scheme for cocoa farmers,"Ghana’s cocoa farmers built this nation. They financed our schools, our roads, our hospitals and our foreign reserves. Yet for decades, when age caught up with them, the system offered them nothing but goodwill and gratitude. That changed in 2020. The Cocoa F…",Thechronicle.com.gh,2026-02-23T05:11:43Z,"Dont cancel the pension scheme for cocoa farmers Ghana’s cocoa farmers built this nation. They financed our schools, our roads, our hospitals and our foreign reserves. Yet for decades, when age caught up with them, the system offered them nothing but goodwill and gratitude. That changed in 2020. The Cocoa F…",dont cancel the pension scheme for cocoa farmers ghanas cocoa farmers built this nation they financed our schools our roads our hospitals and our foreign reserves yet for decades when age caught up with them the system offered them nothing but goodwill and gratitude that changed in the cocoa f,dont cancel pension scheme cocoa farmers ghanas cocoa farmers built nation financed schools roads hospitals foreign reserves yet decades age caught system offered nothing goodwill gratitude changed cocoa,Negative
Editorial Is Our Democracy Metamorphosing Into Moneycracy,"Ghana’s fourth republic, which was born in 1993, has so far been the most stable democracy the country has experienced after deadly post-independence military adventurisms. Since the inception of the Fourth Republic on January 7, 1993 Ghana has seen five dist…",Thechronicle.com.gh,2026-02-23T05:09:13Z,"Editorial Is Our Democracy Metamorphosing Into Moneycracy Ghana’s fourth republic, which was born in 1993, has so far been the most stable democracy the country has experienced after deadly post-independence military adventurisms. Since the inception of the Fourth Republic on January 7, 1993 Ghana has seen five dist…",editorial is our democracy metamorphosing into moneycracy ghanas fourth republic which was born in has so far been the most stable democracy the country has experienced after deadly postindependence military adventurisms since the inception of the fourth republic on january ghana has seen five dist,editorial democracy metamorphosing moneycracy ghanas fourth republic born far stable democracy country experienced deadly postindependence military adventurisms since inception fourth republic january ghana seen five dist,Positive
Israels Bombing decimated Gazas cultural sites as UNESCO responds Tepidly,"UNESCO’s failures have consequences beyond Gaza, as they weaken deterrence of attacks on heritage sites globally",Juancole.com,2026-02-23T05:06:47Z,"Israels Bombing decimated Gazas cultural sites as UNESCO responds Tepidly UNESCO’s failures have consequences beyond Gaza, as they weaken deterrence of attacks on heritage sites globally",israels bombing decimated gazas cultural sites as unesco responds tepidly unescos failures have consequences beyond gaza as they weaken deterrence of attacks on heritage sites globally,israels bombing decimated gazas cultural sites unesco responds tepidly unescos failures consequences beyond gaza weaken deterrence attacks heritage sites globally,Positive
Balen Shah unveils Jhapa5 pledge paper outlines sectorwise commitments,"JHAPA: Senior Rastriya Swatantra Party (RSP) leader Balen Shah has unveiled his election manifesto from Jhapa Constituency-5, naming it the “Jhapa-5 Pledge Paper”. Shah, who is contesting the federal parliamentary seat from the constituency, said the document…",Khabarhub.com,2026-02-23T04:45:52Z,"Balen Shah unveils Jhapa5 pledge paper outlines sectorwise commitments JHAPA: Senior Rastriya Swatantra Party (RSP) leader Balen Shah has unveiled his election manifesto from Jhapa Constituency-5, naming it the “Jhapa-5 Pledge Paper”. Shah, who is contesting the federal parliamentary seat from the constituency, said the document…",balen shah unveils jhapa pledge paper outlines sectorwise commitments jhapa senior rastriya swatantra party rsp leader balen shah has unveiled his election manifesto from jhapa constituency naming it the jhapa pledge paper shah who is contesting the federal parliamentary seat from the constituency said the document,balen shah unveils jhapa pledge paper outlines sectorwise commitments jhapa senior rastriya swatantra party rsp leader balen shah unveiled election manifesto jhapa constituency naming jhapa pledge paper shah contesting federal parliamentary seat constituency said document,Neutral
WATCH Trump Calls USA Hockey Team Invites Them to SOTU After Winning Gold,"President Donald Trump called the U.S. men’s hockey team, and FBI Director Kash Patel joined them in the locker room to celebrate their win over Canada on Sunday.
The post WATCH: Trump Calls USA Hockey Team, Invites Them to SOTU After Winning Gold appeared fi…",Breitbart News,2026-02-23T04:14:05Z,"WATCH Trump Calls USA Hockey Team Invites Them to SOTU After Winning Gold President Donald Trump called the U.S. men’s hockey team, and FBI Director Kash Patel joined them in the locker room to celebrate their win over Canada on Sunday.
The post WATCH: Trump Calls USA Hockey Team, Invites Them to SOTU After Winning Gold appeared fi…",watch trump calls usa hockey team invites them to sotu after winning gold president donald trump called the us mens hockey team and fbi director kash patel joined them in the locker room to celebrate their win over canada on sunday the post watch trump calls usa hockey team invites them to sotu after winning gold appeared fi,watch trump calls usa hockey team invites sotu winning gold president donald trump called mens hockey team fbi director kash patel joined locker room celebrate win canada sunday post watch trump calls usa hockey team invites sotu winning gold appeared,Positive
I Swear One Battle After Another and Sinners dominate Baftas 2026,"Jessie Buckley, Ryan Coogler and Sean Penn all took home major prizes – but it was a British unknown who was the star of the evening",The-independent.com,2026-02-23T04:00:27Z,"I Swear One Battle After Another and Sinners dominate Baftas 2026 Jessie Buckley, Ryan Coogler and Sean Penn all took home major prizes – but it was a British unknown who was the star of the evening",i swear one battle after another and sinners dominate baftas jessie buckley ryan coogler and sean penn all took home major prizes but it was a british unknown who was the star of the evening,swear one battle another sinners dominate baftas jessie buckley ryan coogler sean penn took home major prizes british unknown star evening,Negative
Airways New Zealand warns MPs on global poaching of air traffic controllers,"An aviation group says traffic controller, pilot and engineer shortages are all a problem.",New Zealand Herald,2026-02-23T04:00:00Z,"Airways New Zealand warns MPs on global poaching of air traffic controllers An aviation group says traffic controller, pilot and engineer shortages are all a problem.",airways new zealand warns mps on global poaching of air traffic controllers an aviation group says traffic controller pilot and engineer shortages are all a problem,airways new zealand warns mps global poaching air traffic controllers aviation group says traffic controller pilot engineer shortages problem,Positive
Last Week Tonight with John Oliver S13E02 1080p WEB h264GRACE,"Season 13, Episode 02 –On Last Week Tonight with John Oliver, John Oliver presents a satirical look at the week in news, politics and current events. Links: HOMEPAGE – TVM",Rlsbb.to,2026-02-23T03:32:59Z,"Last Week Tonight with John Oliver S13E02 1080p WEB h264GRACE Season 13, Episode 02 –On Last Week Tonight with John Oliver, John Oliver presents a satirical look at the week in news, politics and current events. Links: HOMEPAGE – TVM",last week tonight with john oliver se p web hgrace season episode on last week tonight with john oliver john oliver presents a satirical look at the week in news politics and current events links homepage tvm,last week tonight john oliver web hgrace season episode last week tonight john oliver john oliver presents satirical look week news politics current events links homepage tvm,Neutral
US assets in Middle East positioned for highly kinetic war exPentagon official warns,"U.S. launches major Middle East military buildup with overwhelming force capabilities against Iran as nuclear talks continue, former Pentagon official Dana Stroul said.",Fox News,2026-02-23T03:32:32Z,"US assets in Middle East positioned for highly kinetic war exPentagon official warns U.S. launches major Middle East military buildup with overwhelming force capabilities against Iran as nuclear talks continue, former Pentagon official Dana Stroul said.",us assets in middle east positioned for highly kinetic war expentagon official warns us launches major middle east military buildup with overwhelming force capabilities against iran as nuclear talks continue former pentagon official dana stroul said,assets middle east positioned highly kinetic war expentagon official warns launches major middle east military buildup overwhelming force capabilities iran nuclear talks continue former pentagon official dana stroul said,Positive
A Knight of the Seven Kingdoms season 1 Episode 6 recap and review The Morrow,"The tourney at Ashford Meadow has reached its somber end, and it's time for Dunk and Egg to set off on their next adventure.",Winter is Coming,2026-02-23T03:31:00Z,"A Knight of the Seven Kingdoms season 1 Episode 6 recap and review The Morrow The tourney at Ashford Meadow has reached its somber end, and it's time for Dunk and Egg to set off on their next adventure.",a knight of the seven kingdoms season episode recap and review the morrow the tourney at ashford meadow has reached its somber end and its time for dunk and egg to set off on their next adventure,knight seven kingdoms season episode recap review morrow tourney ashford meadow reached somber end time dunk egg set next adventure,Neutral
Miranda Devine Dems will roll out their perfect agent of subterfuge Abigail Spanberger in response to SOTU,"Abigail Spanberger, the new governor of Virginia who has been tapped to deliver the Democrats’ State of the Union reply Tuesday night, is the perfect avatar for her party’s deception.",New York Post,2026-02-23T03:28:41Z,"Miranda Devine Dems will roll out their perfect agent of subterfuge Abigail Spanberger in response to SOTU Abigail Spanberger, the new governor of Virginia who has been tapped to deliver the Democrats’ State of the Union reply Tuesday night, is the perfect avatar for her party’s deception.",miranda devine dems will roll out their perfect agent of subterfuge abigail spanberger in response to sotu abigail spanberger the new governor of virginia who has been tapped to deliver the democrats state of the union reply tuesday night is the perfect avatar for her partys deception,miranda devine dems roll perfect agent subterfuge abigail spanberger response sotu abigail spanberger new governor virginia tapped deliver democrats state union reply tuesday night perfect avatar partys deception,Positive
