Title,Description,Source,Date,URL,Topic,full_text,cleaned_text
Reducing import dependence through refining and recycling the way to navigate India Gold sector: Report,India's gold industry is shifting focus from buying to investing. The nation aims to reduce its reliance on imported gold by boosting local refining and recycling efforts. Plans are underway to make India a global center for gold refining and trading. These…,The Times of India,"26 Mar 2026, 06:55",https://economictimes.indiatimes.com/news/economy/foreign-trade/reducing-import-dependence-through-refining-and-recycling-the-way-to-navigate-india-gold-sector-report/articleshow/129817846.cms,technology,Reducing import dependence through refining and recycling the way to navigate India Gold sector: Report India's gold industry is shifting focus from buying to investing. The nation aims to reduce its reliance on imported gold by boosting local refining and recycling efforts. Plans are underway to make India a global center for gold refining and trading. These…,reducing import dependence refining recycling way navigate india gold sector report india gold industry shifting focus buying investing nation aims reduce reliance imported gold boosting local refining recycling efforts plans underway make india global center gold refining trading
COLORFUL Presents iGame Z890 ULTRA-S W and iGame Z890M ULTRA Z Motherboards,"Colorful Technology Company Limited, a leading brand in gaming PC components, gaming laptops, and Hi-fi audio products, proudly introduces the iGame Z890 ULTRA-S W and iGame Z890M ULTRA Z motherboards designed to support the latest Intel Core Ultra 200S Plus …",Madshrimps.be,"26 Mar 2026, 06:51",https://www.madshrimps.be/news/colorful-presents-igame-z890-ultra-s-w-and-igame-z890m-ultra-z-motherboards/,technology,"COLORFUL Presents iGame Z890 ULTRA-S W and iGame Z890M ULTRA Z Motherboards Colorful Technology Company Limited, a leading brand in gaming PC components, gaming laptops, and Hi-fi audio products, proudly introduces the iGame Z890 ULTRA-S W and iGame Z890M ULTRA Z motherboards designed to support the latest Intel Core Ultra 200S Plus …",colorful presents igame ultra igame ultra motherboards colorful technology company limited leading brand gaming components gaming laptops audio products proudly introduces igame ultra igame ultra motherboards designed support latest intel core ultra plus
"Small sleep, exercise and diet changes can cut heart attack and stroke risk","For people with poor habits, these tweaks cut major heart risk by up to 57%.",New Zealand Herald,"26 Mar 2026, 06:48",https://www.nzherald.co.nz/lifestyle/small-sleep-exercise-and-diet-changes-can-cut-heart-attack-and-stroke-risk/XLEXHSXYAFC7TBKDFX72RVABGQ/,technology,"Small sleep, exercise and diet changes can cut heart attack and stroke risk For people with poor habits, these tweaks cut major heart risk by up to 57%.",small sleep exercise diet changes cut heart attack stroke risk people poor habits tweaks cut major heart risk
Diesel Laptops founder Tyler Robertson: New Howes Hall of Fame member,"Howes Products announced Tyler Robertson, founder and CEO of Diesel Laptops, as the newest member of the Howes Hall of Fame for his outstanding contributions to the diesel industry. Likewise: His company’s unwavering commitment to supporting technicians, flee…",Overdriveonline.com,"26 Mar 2026, 06:47",https://www.overdriveonline.com/life/article/15820626/diesel-laptops-founder-tyler-robertson-new-howes-hall-of-fame-member,technology,"Diesel Laptops founder Tyler Robertson: New Howes Hall of Fame member Howes Products announced Tyler Robertson, founder and CEO of Diesel Laptops, as the newest member of the Howes Hall of Fame for his outstanding contributions to the diesel industry. Likewise: His company’s unwavering commitment to supporting technicians, flee…",diesel laptops founder tyler robertson new howes hall fame member howes products announced tyler robertson founder ceo diesel laptops newest member howes hall fame outstanding contributions diesel industry likewise company unwavering commitment supporting technicians flee
"SF Holding Upgraded to “AA” in MSCI ESG Ratings, Reinforcing Its Global Leadership in Sustainable Logistics","SF Holding Upgraded to ""AA"" in MSCI ESG Ratings, Reinforcing Its Global Leadership in Sustainable Logistics",BusinessLine,"26 Mar 2026, 06:45",https://www.thehindubusinessline.com/brandhub/pr-release/sf-holding-upgraded-to-aa-in-msci-esg-ratings-reinforcing-its-global-leadership-in-sustainable-logistics/article70787042.ece,technology,"SF Holding Upgraded to “AA” in MSCI ESG Ratings, Reinforcing Its Global Leadership in Sustainable Logistics SF Holding Upgraded to ""AA"" in MSCI ESG Ratings, Reinforcing Its Global Leadership in Sustainable Logistics",holding upgraded msci esg ratings reinforcing global leadership sustainable logistics holding upgraded msci esg ratings reinforcing global leadership sustainable logistics
"The war and us, the mini-chaos in PASOK, the Intrum experiment, the Fessas–Fourlis engagement, the publishing deal, the Batman from the past","/// The post The war and us, the mini-chaos in PASOK, the Intrum experiment, the Fessas–Fourlis engagement, the publishing deal, the Batman from the past appeared first on ProtoThema English.",Protothema.gr,"26 Mar 2026, 06:41",https://en.protothema.gr/2026/03/26/the-war-and-us-the-mini-chaos-in-pasok-the-intrum-experiment-the-fessas-fourlis-engagement-the-publishing-deal-the-batman-from-the-past/,technology,"The war and us, the mini-chaos in PASOK, the Intrum experiment, the Fessas–Fourlis engagement, the publishing deal, the Batman from the past /// The post The war and us, the mini-chaos in PASOK, the Intrum experiment, the Fessas–Fourlis engagement, the publishing deal, the Batman from the past appeared first on ProtoThema English.",war mini chaos pasok intrum experiment fessas fourlis engagement publishing deal batman past post war mini chaos pasok intrum experiment fessas fourlis engagement publishing deal batman past appeared first protothema english
Championing innovation: Bedfont® Scientific CTO shortlisted for Technology Leader of the Year,"Scott Deamer-Smith, Chief Technology Officer (CTO) at Bedfont® Scientific Limited, has been recognized for his outstanding contribution to innovation and technology.",News-Medical.Net,"26 Mar 2026, 06:39",https://www.news-medical.net/news/20260326/Championing-innovation-Bedfontc2ae-Scientific-CTO-shortlisted-for-Technology-Leader-of-the-Year.aspx,technology,"Championing innovation: Bedfont® Scientific CTO shortlisted for Technology Leader of the Year Scott Deamer-Smith, Chief Technology Officer (CTO) at Bedfont® Scientific Limited, has been recognized for his outstanding contribution to innovation and technology.",championing innovation bedfont scientific cto shortlisted technology leader year scott deamer smith chief technology officer cto bedfont scientific limited recognized outstanding contribution innovation technology
"AMERICA Prayer Vigil March 26, 2026 ~PRAYER~","Join with fellow FREEPERS across the world to pray for AMERICA: For those in Authority in Government, Family, Military, Business, Agri-Business, Healthcare, Education, Churches, Technology, Religious Freedom and the Media. I urge, then, first of all, that req…",Freerepublic.com,"26 Mar 2026, 06:37",https://freerepublic.com/focus/f-religion/4372247/posts,technology,"AMERICA Prayer Vigil March 26, 2026 ~PRAYER~ Join with fellow FREEPERS across the world to pray for AMERICA: For those in Authority in Government, Family, Military, Business, Agri-Business, Healthcare, Education, Churches, Technology, Religious Freedom and the Media. I urge, then, first of all, that req…",america prayer vigil march prayer join fellow freepers across world pray america authority government family military business agri business healthcare education churches technology religious freedom media urge first req
"Palantir CEO thinks people with ADHD, autism, other neudivergence disorders have a unique edge in the AI era",Palantir CEO Alex Karp stated that individuals with vocational training or neurodivergent traits should not fear AI's rise. He emphasizes the importance of unique skills and creativity as a special weapon in the AI era.,Livemint,"26 Mar 2026, 06:33",https://www.livemint.com/companies/people/palantir-ceo-alex-karp-thinks-people-with-adhd-autism-other-neudivergence-disorders-have-a-unique-edge-in-the-ai-era-11774497154873.html,technology,"Palantir CEO thinks people with ADHD, autism, other neudivergence disorders have a unique edge in the AI era Palantir CEO Alex Karp stated that individuals with vocational training or neurodivergent traits should not fear AI's rise. He emphasizes the importance of unique skills and creativity as a special weapon in the AI era.",palantir ceo thinks people adhd autism neudivergence disorders unique edge era palantir ceo alex karp stated individuals vocational training neurodivergent traits fear rise emphasizes importance unique skills creativity special weapon era
iOS 26.4: The Subtle UI Tweaks That Just Refreshed Your Entire iPhone,"Apple has officially launched iOS 26.4, a feature-packed update designed to enhance functionality, improve design, and address critical bugs. With updates spanning the Music app, accessibility tools, privacy features, and performance optimizations, this relea…",Geeky Gadgets,"26 Mar 2026, 06:30",https://www.geeky-gadgets.com/ios-26-4-features/,technology,"iOS 26.4: The Subtle UI Tweaks That Just Refreshed Your Entire iPhone Apple has officially launched iOS 26.4, a feature-packed update designed to enhance functionality, improve design, and address critical bugs. With updates spanning the Music app, accessibility tools, privacy features, and performance optimizations, this relea…",ios subtle tweaks refreshed entire iphone apple officially launched ios feature packed update designed enhance functionality improve design address critical bugs updates spanning music app accessibility tools privacy features performance optimizations relea
Empower women as managers of vital resources: It could help save India from water bankruptcy,"India’s water future hinges on choices made today. We need coordinated action by governments, communities, businesses and individuals. Evidence suggests that women’s leadership at the grassroots can drive behavioural change, keep water use within ‘budgets’ an…",Livemint,"26 Mar 2026, 06:30",https://www.livemint.com/opinion/online-views/empower-women-water-bankruptcy-managers-vital-resources-india-budgeting-conservation-11774449068218.html,technology,"Empower women as managers of vital resources: It could help save India from water bankruptcy India’s water future hinges on choices made today. We need coordinated action by governments, communities, businesses and individuals. Evidence suggests that women’s leadership at the grassroots can drive behavioural change, keep water use within ‘budgets’ an…",empower women managers vital resources could help save india water bankruptcy india water future hinges choices made today need coordinated action governments communities businesses individuals evidence suggests women leadership grassroots drive behavioural change keep water use within budgets
"For the African Market, Tongwei Solar Showcases High-Efficiency Cell Products and Technology Strength at Solar & Storage Live Africa 2026","JOHANNESBURG, March 26, 2026 /PRNewswire/ -- Against the backdrop of growing demand in Africa for efficient, reliable, and sustainable solar products, Tongwei Solar, a Chinese crystalline silicon solar cell manufacturer, appeared at Solar & Storage Live Afric…",PR Newswire UK,"26 Mar 2026, 06:28",https://www.prnewswire.co.uk/news-releases/for-the-african-market-tongwei-solar-showcases-high-efficiency-cell-products-and-technology-strength-at-solar--storage-live-africa-2026-302725819.html,technology,"For the African Market, Tongwei Solar Showcases High-Efficiency Cell Products and Technology Strength at Solar & Storage Live Africa 2026 JOHANNESBURG, March 26, 2026 /PRNewswire/ -- Against the backdrop of growing demand in Africa for efficient, reliable, and sustainable solar products, Tongwei Solar, a Chinese crystalline silicon solar cell manufacturer, appeared at Solar & Storage Live Afric…",african market tongwei solar showcases high efficiency cell products technology strength solar storage live africa johannesburg march prnewswire backdrop growing demand africa efficient reliable sustainable solar products tongwei solar chinese crystalline silicon solar cell manufacturer appeared solar storage live afric
"Go for a walk, man: Sony's drive to create a car parked by partner Honda","CarStation/PlayMobile won’t hit the road after pile-up of tax and competition issues in China and the USA Sony and Honda have broken up, meaning their joint vision to deliver a revolutionary electric vehicle won’t happen.…",Theregister.com,"26 Mar 2026, 06:24",https://www.theregister.com/2026/03/26/honda_sony_jv_hits_pause/,technology,"Go for a walk, man: Sony's drive to create a car parked by partner Honda CarStation/PlayMobile won’t hit the road after pile-up of tax and competition issues in China and the USA Sony and Honda have broken up, meaning their joint vision to deliver a revolutionary electric vehicle won’t happen.…",walk man sony drive create car parked partner honda carstation playmobile hit road pile tax competition issues china usa sony honda broken meaning joint vision deliver revolutionary electric vehicle happen
Bank of England IT project offers lessons for wider government,"The UK central bank’s core IT system replacement project surprised MPs, who were unaccustomed to reviewing success stories – its achievement could potentially serve as a model for future government IT initiatives",ComputerWeekly.com,"26 Mar 2026, 06:20",https://www.computerweekly.com/news/366640719/Bank-of-England-IT-project-offers-lessons-for-wider-government,technology,"Bank of England IT project offers lessons for wider government The UK central bank’s core IT system replacement project surprised MPs, who were unaccustomed to reviewing success stories – its achievement could potentially serve as a model for future government IT initiatives",bank england project offers lessons wider government central bank core system replacement project surprised mps unaccustomed reviewing success stories achievement could potentially serve model future government initiatives
Fuel price package: a vital support or a sop to the rich?,"Business Today: The best news, analysis and comment from The Irish Times business desk",The Irish Times,"26 Mar 2026, 06:17",https://www.irishtimes.com/business/2026/03/26/fuel-price-package-a-vital-support-or-a-sop-to-the-rich/,technology,"Fuel price package: a vital support or a sop to the rich? Business Today: The best news, analysis and comment from The Irish Times business desk",fuel price package vital support sop rich business today best news analysis comment irish times business desk
